24019630,https://www.airbnb.com/rooms/24019630,20220919000909,2022-09-19,city scrape,Century House Maple Suite 18-102571 LI,"Two bedrooms, a large completely refurbished master bath, a well-furnished kitchenette, and two common areas for eating, playing, working, reading, etc. Large queen room with lots of light, table/chairs, rocker, desk, and its own heating/cooling; and quiet corner room with double bed, easy chair, desk. Outside are dozens of shady places to relax, even in the rain.  Your reservation includes a significant morning ""snack"" of fruit, pastry, protein.<br /><br /><b>The space</b><br />Enjoy a large collection of handmade quilts, and a large collection of adventure stories related to bicycling and mountain climbing.  Also, find numerous amenities for young children.  Television is NOT one of them :-). <br />(PLEASE NOTE: The queen bedroom has AC; the double does not, but it is on the shady side of the house with new insulation, new windows, and a ceiling fan.  The AC from the bigger room can be ""shared"" when the door is open.)<br /><br /><b>Guest access</b><br />Gated off-street parking.  Wit",NA,https://a0.muscache.com/pictures/c67044c8-07a8-4556-a8f3-2c7a4c5b79cd.jpg,10502090,https://www.airbnb.com/users/show/10502090,Jean,2013-12-08,"Salem, OR","Bicycling is my passion and my past-time, as well as my recipe for physical and emotional well-being.  Most recently, I have enjoyed “packing down” my bike with gear and heading down the road - for an overnight, or three, or three weeks.  This gives a whole new meaning to “bed and breakfast”.

When I’m not cycling, I’m usually busy cooking, cleaning, reading, sewing or watching the trees and flowers grow in my little forest; and, of course, accommodating the many fascinating guests who find their way to Century House from all corners of the globe.  My life is truly enriched by the diversity of perspectives and experiences that guests bring with them.

I confess, my favorite guests may be the children. With a full career of working in the field of early childhood, I never cease to be wowed by the uninhibited enthusiasm, curiosity, and resilience of the younger generation.  I am thrilled and dedicated to being a family-friendly business.

Another of my endeavors is the promotion/education of good nutrition.  I might be seen pedaling to a local farm to fill my packs with broccoli for the local food bank  - or, with fresh kale for a morning smoothie :-).  Don’t worry, there is still room for a brownie or an oatmeal cookie on the dessert tray.  After all, we need our dark chocolate, and our oatmeal, right?  

",within an hour,100%,100%,TRUE,https://a0.muscache.com/im/users/10502090/profile_pic/1418163815/original.jpg?aki_policy=profile_small,https://a0.muscache.com/im/users/10502090/profile_pic/1418163815/original.jpg?aki_policy=profile_x_medium,Southeast Salem,3,5,"['email', 'phone']",TRUE,TRUE,NA,Ward 2,NA,44.93373,-123.01971,Private room in home,Private room,4,NA,1 private bath,2,2,"[""Essentials"", ""Host greets you"", ""Portable fans"", ""Private entrance"", ""Bed linens"", ""Children\u2019s books and toys"", ""Ceiling fan"", ""Refrigerator"", ""Luggage dropoff allowed"", ""Wifi"", ""Heating"", ""Shampoo"", ""Hair dryer"", ""Long term stays allowed"", ""Hangers"", ""Conditioner"", ""High chair"", ""Outlet covers"", ""Indoor fireplace"", ""Pack \u2019n play/Travel crib"", ""Cooking basics"", ""Washer \u2013\u00a0In building"", ""Kitchen"", ""Air conditioning"", ""Dryer \u2013 In building"", ""Fireplace guards"", ""Smoke alarm"", ""First aid kit"", ""Dishes and silverware"", ""Free street parking"", ""Microwave"", ""Fire extinguisher"", ""Iron"", ""Free parking on premises"", ""Piano"", ""Rice maker"", ""Carbon monoxide alarm"", ""Hot water"", ""Lock on bedroom door"", ""Backyard"", ""Body soap"", ""Coffee maker"", ""Extra pillows and blankets""]",$155.00,2,1125,2,2,1125,1125,2,1125,NA,TRUE,8,38,58,315,2022-09-19,21,3,0,2018-04-20,2022-07-11,4.95,4.95,4.9,4.95,5,4.9,4.95,NA,FALSE,3,0,3,0,0.39,salem,MA
24373913,https://www.airbnb.com/rooms/24373913,20220919000909,2022-09-19,city scrape,Sasquatch’s Cozy Stay,"Subtle touches make this space special: sliding barn doors, open layout, radiant heat in the porcelain and bamboo floors, organic cotton towels, and organic percale sheets with both down and synthetic pillows. Enjoy the garden on sunny days and covered patio when it rains.<br /><br />PLEASE NOTE: The layout, doors, and shared common space means less privacy. Great for crashing after a conference, not for honeymooners. Courteous single visitors, travel nurses, and road trippers preferred.<br /><br /><b>The space</b><br />Walking in the front door, you’ll find yourself in the largest room in the house, the living room. To the left, two open doorways lead to the kitchen, dining area, and bathroom. The main bedroom is immediately to the right when you walk into the living room, and guest room is past the couch, also to the right in the back/ north-most part of the house. Directly across the guest room on the other side of the living room is the laundry room which features a sliding patio d","The neighborhood (Grant) is cute and friendly, and the house is sandwiched by an elementary school and Boys and Girls Club. There’s also a church across the street that has band practice on Tuesday evenings- the music is wonderful! During the school year there is a drop off/ pick up rush twice a day but it only lasts about 15 minutes. Once in a while there is a Boys and Girls Club event that also spurs some extra traffic, but the sounds of children laughing always outweighs it. The house is within walking distance to Broadway Coffee, Barrel and Keg wine bar and tap house, Salem Cinema, Christo's Pizza, McMenamins' Brewery, Tony’s Tacos, among other local gems. Downtown proper is about a mile away and the capitol buildings and Saturday Market are a 15 minute walk. Please let me know if you need recommendations for food, beverages, or sight-seeing.",https://a0.muscache.com/pictures/3302cfdc-b9ff-4bbf-aadc-1d1ed5f32528.jpg,67196252,https://www.airbnb.com/users/show/67196252,Marissa,2016-04-14,"Salem, OR","I moved to Salem in September 2016 for a promotion as a soil scientist. I love that I get to be outside and examine nature for work. For fun I practice yoga, taste and brew beer, hike, x-country ski, snowshoe, see live music, garden, and read. I'm always looking for new ways to grow and explore!",within an hour,100%,90%,TRUE,https://a0.muscache.com/im/pictures/user/2b8c49c9-28db-44d5-8d71-e5d55845dea2.jpg?aki_policy=profile_small,https://a0.muscache.com/im/pictures/user/2b8c49c9-28db-44d5-8d71-e5d55845dea2.jpg?aki_policy=profile_x_medium,NA,1,1,"['email', 'phone']",TRUE,TRUE,"Salem, Oregon, United States",Ward 1,NA,44.95176,-123.02568,Private room in bungalow,Private room,1,NA,1 shared bath,1,1,"[""Essentials"", ""Portable fans"", ""Hot water kettle"", ""Safe"", ""Bed linens"", ""Radiant heating"", ""Toaster"", ""Room-darkening shades"", ""Free driveway parking on premises \u2013 1 space"", ""Luggage dropoff allowed"", ""Bidet"", ""LG refrigerator"", ""Wifi"", ""Dining table"", ""Dr. Bronners body soap"", ""Freezer"", ""Free dryer \u2013 In unit"", ""Shower gel"", ""Hair dryer"", ""Outdoor dining area"", ""Bathtub"", ""Lockbox"", ""Hangers"", ""Barbecue utensils"", ""Frigidaire  stainless steel oven"", ""Surface shampoo"", ""Frigidaire  electric stove"", ""Window AC unit"", ""45\"" HDTV with Amazon Prime Video, Netflix"", ""Cooking basics"", ""Security cameras on property"", ""Kitchen"", ""Private fenced garden or backyard"", ""Dishes and silverware"", ""Smoke alarm"", ""First aid kit"", ""Free street parking"", ""Wine glasses"", ""Microwave"", ""Surface conditioner"", ""Fire extinguisher"", ""Fire pit"", ""Free washer \u2013 In unit"", ""Iron"", ""Board games"", ""BBQ grill"", ""Private patio or balcony"", ""Rice maker"", ""Clothing storage: closet and dresser"", ""Hot water"", ""Lock on bedroom door"", ""Baking sheet"", ""Single level home"", ""Outdoor furniture"", ""Extra pillows and blankets"", ""Dishwasher""]",$60.00,1,4,1,1,4,4,1,4,NA,TRUE,7,7,7,7,2022-09-19,24,19,1,2018-07-30,2022-08-21,4.71,4.88,4.96,4.92,4.71,4.92,4.83,NA,FALSE,1,0,1,0,0.48,salem,MA
24780208,https://www.airbnb.com/rooms/24780208,20220919000909,2022-09-19,city scrape,Guest Cottage at Vista Manor,"Guest cottage located in South Salem on a large wooded lot. Close to restaurants, grocery stores, Banks, Parks, Willamette University and Salem Hospital. The bedroom is upstairs king with a king size bed. The sofa bed that is a double, is on the first floor. When we enter into spring ants are out. If food is left out on counters and tables it will attract ants. I ask guests not to leave food out. Guests who have been conscientious have not had an issue.<br /><br /><b>The space</b><br />The guest Cottage is a separate unit  attached to the main home but has a private entrance.My home was built in the 1920s. It is on a acre wooded lot. We have chickens, ducks, 3 cats and a dog. The animals are in a back  area of the property. Only the doggie comes out to visit our guests. Our guest of course are welcome to visit all the animals.<br /><br /><b>Guest access</b><br />The guest cottage is located on a large lot with lots of trees. Guests are welcome to enjoy the patios and yard.<br /><br /><","I love my neighborhood. There are parks in walking distance, restaurants, grocery store.",https://a0.muscache.com/pictures/miso/Hosting-24780208/original/4c871fae-f203-4dd5-863a-dfd420d5811a.jpeg,49073704,https://www.airbnb.com/users/show/49073704,Elizabeth,2015-11-15,"Salem, OR","I am a nurse who has an Airbnb, Vista Manor in Salem Oregon. Love to travel, read hike, swim, cook and spend time with my family.",within an hour,100%,100%,TRUE,https://a0.muscache.com/im/pictures/user/a62c6b8d-4855-4f5c-b60a-316c36fa06a9.jpg?aki_policy=profile_small,https://a0.muscache.com/im/pictures/user/a62c6b8d-4855-4f5c-b60a-316c36fa06a9.jpg?aki_policy=profile_x_medium,NA,11,12,"['email', 'phone']",TRUE,FALSE,"Salem, Oregon, United States",Ward 2,NA,44.91053,-123.04313,Entire guesthouse,Entire home/apt,4,NA,1 bath,1,2,"[""Essentials"", ""Cable TV"", ""Private entrance"", ""Bed linens"", ""Babysitter recommendations"", ""Toaster"", ""Children\u2019s books and toys"", ""Refrigerator"", ""Luggage dropoff allowed"", ""Wifi"", ""Dining table"", ""Heating"", ""Shampoo"", ""Baby bath"", ""Shower gel"", ""Hair dryer"", ""Long term stays allowed"", ""Hangers"", ""Conditioner"", ""Clothing storage: dresser and closet"", ""High chair"", ""Patio or balcony"", ""Cleaning before checkout"", ""Stove"", ""Children\u2019s dinnerware"", ""Indoor fireplace"", ""Smart lock"", ""Pack \u2019n play/Travel crib"", ""Cooking basics"", ""Security cameras on property"", ""Oven"", ""Breakfast"", ""Kitchen"", ""Air conditioning"", ""Dishes and silverware"", ""Smoke alarm"", ""First aid kit"", ""Free street parking"", ""Wine glasses"", ""Microwave"", ""Fire extinguisher"", ""Iron"", ""Board games"", ""Free parking on premises"", ""Rice maker"", ""Carbon monoxide alarm"", ""Hot water"", ""Backyard"", ""Baking sheet"", ""Outdoor furniture"", ""Body soap"", ""Crib"", ""Coffee maker"", ""Cleaning products"", ""TV with standard cable"", ""Extra pillows and blankets"", ""Dishwasher""]",$199.00,1,1125,1,1,1125,1125,1,1125,NA,TRUE,8,38,67,67,2022-09-19,468,96,5,2018-05-04,2022-09-11,4.93,4.95,4.88,4.98,4.98,4.94,4.93,NA,FALSE,5,1,4,0,8.78,salem,MA
25535122,https://www.airbnb.com/rooms/25535122,20220919000909,2022-09-19,city scrape,The River Retreat,"Enjoy the beautiful Willamette river & sunset views while sitting around the fire. Kayak , fish, or float during the day, and retreat to your oasis in the evening. With 5 bedrooms, a large living and family room for everyone, and an open kitchen for entertaining, our home has everything you need for your perfect getaway. Enjoy the view from the exquisite sunroom w/heated wood floors. Beautifully landscaped, with a patio area and BBQ for entertaining.<br /><br /><b>The space</b><br />You have the entire house and rare access to the river in Salem / Keizer!  You'll have direct access to the Willamette River from the property- perfect for a day of floating, fishing, or boating.  The yard has three levels- the top level features mature landscaping, adirondack chairs, a fire pit, patio seating and BBQ. The middle level offers a small cottage with a full size pull out couch and chair, and the lower level features an expansive grass area with direct access to the river. <br /><br /><br /><br","This is a very unique opportunity to stay on the Willamette River in the Salem / Keizer area.  The park like setting in the back yard directly on the river will not disappoint!<br /><br />The home sits directly on a bike/walking route that goes throughout Keizer. The neighborhood is a quiet residential area. Its close to several parks and playgrounds, as well as River Rd which hosts many businesses, restaurants, and services. It is about a 3 minute drive from the house to the Salem Parkway, and a five minute drive to Downtown Salem or I-5.",https://a0.muscache.com/pictures/5d95f843-9792-48fb-bfcc-2d65229bc754.jpg,12521761,https://www.airbnb.com/users/show/12521761,Maryanne,2014-02-24,"Salem, OR","Wife, Mama, Native Oregonian, Weaver, Believer.",N/A,N/A,N/A,FALSE,https://a0.muscache.com/im/pictures/user/c72f049b-b503-47b4-b6e6-8d69fe80c8c0.jpg?aki_policy=profile_small,https://a0.muscache.com/im/pictures/user/c72f049b-b503-47b4-b6e6-8d69fe80c8c0.jpg?aki_policy=profile_x_medium,NA,1,1,"['email', 'phone']",TRUE,FALSE,"Keizer, Oregon, United States",Ward 5,NA,44.97843,-123.03564,Entire home,Entire home/apt,8,NA,2.5 baths,5,5,"[""Essentials"", ""Hot water kettle"", ""Private entrance"", ""Bed linens"", ""Toaster"", ""Children\u2019s books and toys"", ""Refrigerator"", ""Wifi"", ""Dining table"", ""Heating"", ""Shampoo"", ""Freezer"", ""Free dryer \u2013 In unit"", ""Record player"", ""Shower gel"", ""Hair dryer"", ""Outdoor dining area"", ""Long term stays allowed"", ""Bathtub"", ""Lockbox"", ""Stove"", ""TV"", ""Children\u2019s dinnerware"", ""Indoor fireplace"", ""Barbecue utensils"", ""Lake access"", ""Pack \u2019n play/Travel crib"", ""Cooking basics"", ""Security cameras on property"", ""Oven"", ""Kitchen"", ""Air conditioning"", ""Dishes and silverware"", ""Smoke alarm"", ""First aid kit"", ""Free street parking"", ""Wine glasses"", ""Microwave"", ""Fire extinguisher"", ""Fire pit"", ""Waterfront"", ""Free washer \u2013 In unit"", ""Iron"", ""Board games"", ""BBQ grill"", ""Private patio or balcony"", ""Free parking on premises"", ""Rice maker"", ""Clothing storage: closet and dresser"", ""Hot water"", ""Carbon monoxide alarm"", ""Baking sheet"", ""Outdoor furniture"", ""Private garden or backyard"", ""Body soap"", ""Coffee maker"", ""Cleaning products"", ""Extra pillows and blankets"", ""Dishwasher""]",$514.00,2,1125,2,2,1125,1125,2,1125,NA,TRUE,18,34,57,302,2022-09-19,84,14,1,2018-06-27,2022-09-04,4.79,4.86,4.43,4.98,4.92,4.89,4.79,NA,FALSE,1,1,0,0,1.63,salem,MA
25873321,https://www.airbnb.com/rooms/25873321,20220919000909,2022-09-19,city scrape,"Ground floor guest suite: city, woods, wineries","A beautifully unique cedar craft home on small acreage on the edge of town, this ground floor guest suite has all the amenities of my favorite hotels, like Hyatt, Westin and Marriott. This rustic-modern space has a kitchenette, fridge, freezer, filtered water, microwave, hot plate, toaster and several coffee makers. <br /><br />Deer are daily visitors, and nature lovers will love the  variety of wild birds on the property, along with many other friendly critters.<br /><br />No cleaning fees. No extra fees for pets.<br /><br /><b>The space</b><br />Over 1,500 square feet of relaxed, peaceful living in this Retreat at AntlerWood Hollow. How are we in the middle of the woods, yet only 4 minutes from the heart of Oregon's capital city? <br /><br />Remodeled in late 2017, much thought has been put into this ground floor escape. Friends and guests describe this home as ""the most Oregon home"" they have ever seen. I agree. <br /><br />I love Oregon and this property has the best of Oregon. The","This home is about a half-mile from a neighborhood park, and just one more mile to the largest connected park system in the country! The property is on a country road and so you won't run into neighbors. It's a busy country road but you're up on the hill so traffic noise isn't really an issue.",https://a0.muscache.com/pictures/77a96847-0ec9-4669-8523-a4a4f65f092b.jpg,89498854,https://www.airbnb.com/users/show/89498854,Kyle,2016-08-12,"Salem, OR","I'm clean, quiet, organized and polite. I take pride in cleaning up after myself and leaving the smallest imprint possible. 

I travel for work and occasionally to explore. I'm a marketing consultant and work with community organizations.",within an hour,100%,100%,FALSE,https://a0.muscache.com/im/pictures/user/c2e068f9-00a0-4828-8536-59395cf865a5.jpg?aki_policy=profile_small,https://a0.muscache.com/im/pictures/user/c2e068f9-00a0-4828-8536-59395cf865a5.jpg?aki_policy=profile_x_medium,NA,1,1,"['email', 'phone', 'work_email']",TRUE,FALSE,"Salem, Oregon, United States",Ward 7,NA,44.89687,-123.07442,Entire guest suite,Entire home/apt,4,NA,1 bath,1,2,"[""Essentials"", ""Cable TV"", ""40\"" HDTV with standard cable, Amazon Prime Video, HBO Max, Netflix, premium cable"", ""Portable fans"", ""Hot water kettle"", ""Private entrance"", ""Bed linens"", ""Ethernet connection"", ""Toaster"", ""Room-darkening shades"", ""Central air conditioning"", ""Refrigerator"", ""Luggage dropoff allowed"", ""Wifi"", ""Dining table"", ""Shampoo"", ""Freezer"", ""Free dryer \u2013 In unit"", ""Free driveway parking on premises \u2013 3 spaces"", ""Shower gel"", ""Hair dryer"", ""Outdoor dining area"", ""Shared garden or backyard"", ""Long term stays allowed"", ""Lockbox"", ""Hangers"", ""Conditioner"", ""Dedicated workspace"", ""Cooking basics"", ""Security cameras on property"", ""Central heating"", ""Kitchen"", ""Dishes and silverware"", ""Smoke alarm"", ""Drying rack for clothing"", ""Wine glasses"", ""Microwave"", ""Fire extinguisher"", ""Fire pit"", ""Free washer \u2013 In unit"", ""Iron"", ""Board games"", ""Clothing storage: dresser"", ""Keurig coffee machine"", ""Private patio or balcony"", ""Carbon monoxide alarm"", ""Hot water"", ""Single level home"", ""Portable heater"", ""Outdoor furniture"", ""Body soap"", ""Coffee maker"", ""Induction stove"", ""Cleaning products"", ""Extra pillows and blankets""]",$138.00,2,1125,2,2,1125,1125,2,1125,NA,TRUE,3,27,57,326,2022-09-19,129,30,3,2018-06-24,2022-09-06,4.97,4.96,4.92,4.99,4.98,4.95,4.96,NA,FALSE,1,1,0,0,2.5,salem,MA
26093732,https://www.airbnb.com/rooms/26093732,20220919000909,2022-09-19,city scrape,Hazelnut House.  Entire 2bd 1bt Close to I-5,"You'll be close to everything Salem, yet away enough for a quiet stay.  This is an entire unit in a duplex with privacy.<br /><br />Enjoy fast wifi, full coverage cell service, and Xfinity hotspot service.<br /><br />You'll have the entire place to yourself.  My family lived here from 2015-2022 when we decided to move to a bigger place.  We rent our place exclusively on Airbnb and our retired parents have the space nextdoor.<br /><br />We live close enough to help if any issues arrise.  We'd love to interact if you desire.<br /><br /><b>The space</b><br />A two bedroom, one bath apartment with tons of light, completely private.  It's furnished with kids in mind, meaning there are no valuable heirlooms.   Large fur trees give plenty of shade and a large yard lets you enjoy our Salem weather.<br /><br />There's two bedrooms, a master and a second.  <br /><br />The second room has two twin beds with memory foam mattresses.  A ceiling fan, closet, and places to charge your devices.<br /> <","Located walking distance to grocery and restaurants, this area is know as 'Four Corners'.  Just minutes to the interstate 5 north and south on ramp, and right off the 22 hwy.  We're a quick 10 minute drive to the Salem River Park, Keizer Station, Salem Health, Salem Airport, Walmart, and Costco.  Winco, Wilco, Liquor and food within 1-2 miles<br /><br />The neighborhood is kind and very 8-5.  Please treat our neighbors with respect.  Our community has mixed race and culture.  Hate is not tolerated.",https://a0.muscache.com/pictures/miso/Hosting-26093732/original/3b4d7b8b-7e80-4c99-8298-99322bdfff5e.jpeg,124647335,https://www.airbnb.com/users/show/124647335,Peter,2017-04-07,"Oregon, United States","I host and stay in the airbnb community.  I love the airbnb community.   I'm respectful, non smoker.  I treat my rentals like my own.  

I work as a manufacturers rep to the glazing industry throughout OR WA ID and MT.  Most of my stays are for business so I've become very self sufficient.  

I fish, travel, cook, and love to learn new things, cultures, and places...",within an hour,100%,100%,FALSE,https://a0.muscache.com/im/pictures/user/5096b152-d3b2-431f-88a2-44d9a571545a.jpg?aki_policy=profile_small,https://a0.muscache.com/im/pictures/user/5096b152-d3b2-431f-88a2-44d9a571545a.jpg?aki_policy=profile_x_medium,NA,1,1,"['email', 'phone']",TRUE,TRUE,"Salem, Oregon, United States",Ward 6,NA,44.922543,-122.966286,Entire rental unit,Entire home/apt,6,NA,1 bath,2,3,"[""Essentials"", ""Cable TV"", ""Portable fans"", ""Hot water kettle"", ""Private entrance"", ""Radiant heating"", ""Bed linens"", ""Ethernet connection"", ""Toaster"", ""Herbal Essence (subject to change) body soap"", ""Ceiling fan"", ""Refrigerator"", ""Luggage dropoff allowed"", ""Wifi"", ""Dining table"", ""Shampoo"", ""Freezer"", ""Free dryer \u2013 In unit"", ""Children\u2019s books and toys for ages 2-5 years old and 5-10 years old"", ""Shower gel"", ""Hair dryer"", ""Long term stays allowed"", ""Bathtub"", ""Lockbox"", ""Hangers"", ""Stove"", ""Children\u2019s dinnerware"", ""Indoor fireplace"", ""Washer"", ""Window AC unit"", ""Cooking basics"", ""Oven"", ""Kitchen"", ""Dishes and silverware"", ""Smoke alarm"", ""Baby safety gates"", ""First aid kit"", ""Free street parking"", ""Wine glasses"", ""Microwave"", ""Herbal Essense (subject to change) conditioner"", ""Fire extinguisher"", ""Private patio or balcony"", ""Bluetooth  Bluetooth sound system"", ""Board games"", ""Free parking on premises"", ""Clothing storage: closet"", ""Hot water"", ""Backyard"", ""Baking sheet"", ""Single level home"", ""Coffee maker"", ""Cleaning products"", ""TV with standard cable"", ""Extra pillows and blankets"", ""Dishwasher""]",$151.00,1,90,1,1,1125,1125,1,1125,NA,TRUE,11,30,43,43,2022-09-19,34,28,11,2018-07-25,2022-09-12,4.97,4.97,4.91,5,5,4.71,4.91,NA,FALSE,1,1,0,0,0.67,salem,MA
