id,listing_url,scrape_id,last_scraped,source,name,description,neighborhood_overview,picture_url,host_id,host_url,host_name,host_since,host_location,host_about,host_response_time,host_response_rate,host_acceptance_rate,host_is_superhost,host_thumbnail_url,host_picture_url,host_neighbourhood,host_listings_count,host_total_listings_count,host_verifications,host_has_profile_pic,host_identity_verified,neighbourhood,neighbourhood_cleansed,neighbourhood_group_cleansed,latitude,longitude,property_type,room_type,accommodates,bathrooms,bathrooms_text,bedrooms,beds,amenities,price,minimum_nights,maximum_nights,minimum_minimum_nights,maximum_minimum_nights,minimum_maximum_nights,maximum_maximum_nights,minimum_nights_avg_ntm,maximum_nights_avg_ntm,calendar_updated,has_availability,availability_30,availability_60,availability_90,availability_365,calendar_last_scraped,number_of_reviews,number_of_reviews_ltm,number_of_reviews_l30d,first_review,last_review,review_scores_rating,review_scores_accuracy,review_scores_cleanliness,review_scores_checkin,review_scores_communication,review_scores_location,review_scores_value,license,instant_bookable,calculated_host_listings_count,calculated_host_listings_count_entire_homes,calculated_host_listings_count_private_rooms,calculated_host_listings_count_shared_rooms,reviews_per_month,city,state
199568,https://www.airbnb.com/rooms/199568,20220919000909,2022-09-19,city scrape,Garden studio apt,"Light and roomy, opening onto garden, this apartment is private, quiet and secure. There is a queen bed in the spacious combined bedroom/ sitting room that opens onto a private garden patio. In addition, enjoy your own bookshelf-lined den that includes a couch, TV, dining area, and electric fireplace. The apartment includes a kitchen/laundry room and bathroom.  Close to downtown and to bike and walking trails. Special pricing available for monthly or longer stays.<br /><br /><b>The space</b><br />Only an hour's drive from the Pacific coast, the Cascade mountains, or Portland's many food, brew, literary, hip culture attractions, Salem is easy to get around with plenty of historic buildings, parks and gardens, brewpubs and wineries. From the house you can walk or bike to all many services or stretch out and cross the river to downtown on the beautiful pedestrian bridge.  <br />The downstairs suite of about 900 sq ft or +/- 100 sq m includes a large, dividable bedroom space with queen bed","There are 2 good-sized parks nearby, hilly neighborhoods and the many services within a mile or so, including a popular brewpub/distinctive Mexican eatery.  After your arrival here, it is not necessary to drive everywhere to enjoy this simple family neighborhood, and the greenness of the area.  Extended bike/walking paths lead across the river and south through green areas, with extended distance for a peaceful outdoors workout.",https://a0.muscache.com/pictures/f62ce7d3-7813-4c50-a346-6f581981df3a.jpg,974919,https://www.airbnb.com/users/show/974919,Sara,2011-08-15,"Salem, OR","An avid traveler and lover of the outdoors, I taught adult literacy and English to non-native speakers.   I enjoy winter skiing,  summer hiking , road trips or river trips, music, reading and favorite small children.  History, gardening, poetry and literature, food, agriculture are some of my interests.  Turkey, Greece, Ukraine, Mexico, Switzerland and France are places I've settled in for several weeks at a time.  In fact, staying in one place while exploring all around suits me better than continuous travel, and that's the experience I'd like to enable as a host.  Salem itself has much to offer besides options for scenic day trips: to the Pacific, to wineries of all sorts, cities north and south (Portland and Eugene), the Columbia Gorge and Mt Hood, waterfalls and forests, art galleries and museums.
One of my strengths is connecting folks with resources and opportunities.  At work, that's been my focus in helping newcomers with cultural adjustment.  Helping guests get the most from their time here appeals to me.  I also value independence and privacy, so knowing what guests prefer can make a good stay for us both. 
",within an hour,100%,97%,TRUE,https://a0.muscache.com/im/users/974919/profile_pic/1314473925/original.jpg?aki_policy=profile_small,https://a0.muscache.com/im/users/974919/profile_pic/1314473925/original.jpg?aki_policy=profile_x_medium,NA,2,4,"['email', 'phone']",TRUE,FALSE,"Salem, Oregon, United States",Ward 1,NA,44.95196,-123.05627,Entire guest suite,Entire home/apt,2,NA,1 bath,1,1,"[""Essentials"", ""Host greets you"", ""Portable fans"", ""Hot water kettle"", ""Private entrance"", ""Bed linens"", ""Babysitter recommendations"", ""Mini fridge"", ""Toaster"", ""Children\u2019s books and toys"", ""Ceiling fan"", ""Refrigerator"", ""Luggage dropoff allowed"", ""Wifi"", ""Dining table"", ""Heating"", ""Shampoo"", ""Freezer"", ""Hair dryer"", ""Outdoor dining area"", ""Long term stays allowed"", ""Hangers"", ""Conditioner"", ""Kayak"", ""Outlet covers"", ""Stove"", ""TV"", ""Children\u2019s dinnerware"", ""Indoor fireplace"", ""Barbecue utensils"", ""Private fenced garden or backyard"", ""Dedicated workspace"", ""Washer"", ""Pack \u2019n play/Travel crib"", ""Cooking basics"", ""Kitchen"", ""Air conditioning"", ""Fireplace guards"", ""Smoke alarm"", ""Baby safety gates"", ""First aid kit"", ""Drying rack for clothing"", ""Wine glasses"", ""Microwave"", ""Dishes and silverware"", ""Fire extinguisher"", ""BBQ grill"", ""Iron"", ""Board games"", ""Pour-over coffee"", ""Keurig coffee machine"", ""Private patio or balcony"", ""Rice maker"", ""Free driveway parking on premises"", ""Clothing storage: closet and dresser"", ""Hot water"", ""Dryer"", ""Carbon monoxide alarm"", ""Single level home"", ""Outdoor furniture"", ""Body soap"", ""Coffee maker"", ""Cleaning products"", ""Extra pillows and blankets""]",$105.00,5,100,5,5,100,100,5,100,NA,TRUE,18,18,18,18,2022-09-19,188,19,0,2011-08-29,2022-07-29,4.9,4.91,4.93,4.96,4.96,4.86,4.92,NA,FALSE,1,1,0,0,1.4,salem,MA
7293821,https://www.airbnb.com/rooms/7293821,20220919000909,2022-09-19,city scrape,Chauffeurs Room @ the Villa,"NEWLY RENOVATED! Our home is in the quaint historic Fairmount Hills Neighborhood. This loft is great for business travelers, couples, and solo adventurers. We are close to Downtown, Bush Park, Salem Hospital, Willamette University,  and Convention Center. We are also a great home base  for exploring wineries and other communities. Our neighborhood is a safe place to walk and explore and our property has security cameras to enhance your safety.<br /><br /><b>The space</b><br />The studio is a quiet, private retreat above the garage, with all the necessities for a comfortable stay. The kitchen is equipped with fridge, microwave, hotplate, toaster and electric kettle. <br /><br />We will get you started with homemade granola and sometimes a baked treat.  Complimentary tea and coffee are provided along with a long list of restaurant recommendations. <br /><br />The queen size, pillow top mattress is made up with luxury linens. <br /><br />Guests are welcome to use the back patio and feel f","Safe, quiet community, historic neighborhood. The studio is a few blocks from the Salem Art Fair, a short walk to eateries, museums, library, parks, Salem Hospital, Willamette University and the Capitol. This is wine country and we will be happy to share our favorites for you to visit.",https://a0.muscache.com/pictures/miso/Hosting-7293821/original/a10ac311-5406-4281-8c2c-5717b07b6d46.jpeg,38202007,https://www.airbnb.com/users/show/38202007,Julie,2015-07-11,"Salem, OR","We are an active couple that loves our home, neighborhood and surrounding area. We love the solitude of hiking and the warmth of an evening surrounded by family and friends.",within an hour,100%,100%,TRUE,https://a0.muscache.com/im/pictures/user/1e803e60-ae1c-4e3d-953f-d6bef834b220.jpg?aki_policy=profile_small,https://a0.muscache.com/im/pictures/user/1e803e60-ae1c-4e3d-953f-d6bef834b220.jpg?aki_policy=profile_x_medium,NA,1,2,"['email', 'phone']",TRUE,TRUE,"Salem, Oregon, United States",Ward 7,NA,44.92484,-123.0499,Entire guest suite,Entire home/apt,2,NA,1 bath,NA,1,"[""Essentials"", ""Cable TV"", ""Private entrance"", ""Bed linens"", ""Refrigerator"", ""Luggage dropoff allowed"", ""Wifi"", ""Heating"", ""Shampoo"", ""Hair dryer"", ""Lockbox"", ""Hangers"", ""Patio or balcony"", ""Pack \u2019n play/Travel crib"", ""Cooking basics"", ""Security cameras on property"", ""Breakfast"", ""Kitchen"", ""Air conditioning"", ""Dishes and silverware"", ""Smoke alarm"", ""First aid kit"", ""Free street parking"", ""Microwave"", ""Fire extinguisher"", ""BBQ grill"", ""Iron"", ""Free parking on premises"", ""Carbon monoxide alarm"", ""Hot water"", ""Backyard"", ""Coffee maker"", ""TV with standard cable"", ""Extra pillows and blankets""]",$105.00,2,21,2,4,1125,1125,2.1,1125,NA,TRUE,13,31,60,60,2022-09-19,376,29,2,2015-07-19,2022-09-13,4.95,4.98,4.98,4.97,4.99,4.98,4.9,NA,FALSE,1,1,0,0,4.31,salem,MA
7897605,https://www.airbnb.com/rooms/7897605,20220919000909,2022-09-19,city scrape,Bohemian rhapsody room,"We are located in a quiet cul de sac with easy access to I-5, Keizer Station and downtown. The room features a queen size bed--super comfy. The bedding includes down pillows and a down comforter. There is an adjacent space with an office--place to hook up your computer and we offer complimentary wifi service for all of our guests. We have 2 cats that are friendly but will stay out of your room--for the most part. Our room includes a mini fridge, microwave, Kuerig coffee maker and coffee supplies<br /><br /><b>The space</b><br />We are conveniently located near I-5, downtown and many amenities. This room has a small attached office area. It also features a microwave & mini fridge.<br /><br />Down comforter on the bed, large flat screen so it’s super comfy.<br /><br /><b>Guest access</b><br />Kitchen, bathroom, private guest room with a microwave and desk. Free wifi too! We also have an outdoor hot tub that guests are welcome to use.<br /><br /><b>Other things to note</b><br />Please no",We live on a quiet cul de sac with great neighbors,https://a0.muscache.com/pictures/9172782a-69c9-408d-863d-8ad94facb469.jpg,35031501,https://www.airbnb.com/users/show/35031501,Shelley,2015-06-04,"Salem, OR",NA,within an hour,100%,93%,TRUE,https://a0.muscache.com/im/pictures/user/f6d278eb-adec-475f-adae-4c1eb3ddd7d7.jpg?aki_policy=profile_small,https://a0.muscache.com/im/pictures/user/f6d278eb-adec-475f-adae-4c1eb3ddd7d7.jpg?aki_policy=profile_x_medium,NA,2,2,"['email', 'phone', 'work_email']",TRUE,TRUE,"Salem, Oregon, United States",Ward 6,NA,44.97032,-122.96332,Private room in home,Private room,2,NA,1 shared bath,1,1,"[""Essentials"", ""Cable TV"", ""Portable fans"", ""Fast wifi \u2013 393 Mbps"", ""Hot water kettle"", ""Bed linens"", ""Mini fridge"", ""Toaster"", ""Room-darkening shades"", ""Ceiling fan"", ""Refrigerator"", ""Luggage dropoff allowed"", ""Dining table"", ""Heating"", ""Shampoo"", ""Freezer"", ""Shower gel"", ""Hair dryer"", ""Outdoor dining area"", ""Long term stays allowed"", ""Bathtub"", ""Lockbox"", ""Hangers"", ""Conditioner"", ""High chair"", ""Shared patio or balcony"", ""Stove"", ""Barbecue utensils"", ""Indoor fireplace"", ""Bread maker"", ""Washer"", ""Cooking basics"", ""Oven"", ""Kitchen"", ""Air conditioning"", ""Dishes and silverware"", ""Smoke alarm"", ""Free street parking"", ""Wine glasses"", ""Microwave"", ""Fire extinguisher"", ""Fire pit"", ""BBQ grill"", ""Iron"", ""Board games"", ""Free parking on premises"", ""Keurig coffee machine"", ""Shared hot tub"", ""Rice maker"", ""Clothing storage: closet and dresser"", ""Hot water"", ""Dryer"", ""Carbon monoxide alarm"", ""Baking sheet"", ""Outdoor furniture"", ""Single level home"", ""Private garden or backyard"", ""Body soap"", ""Coffee maker"", ""Cleaning products"", ""TV with standard cable"", ""Extra pillows and blankets"", ""Dishwasher""]",$55.00,2,1125,2,2,1125,1125,2,1125,NA,TRUE,2,30,54,325,2022-09-19,81,13,0,2015-11-08,2022-07-20,4.99,4.99,5,4.99,5,4.95,4.99,NA,FALSE,2,0,2,0,0.97,salem,MA
8522149,https://www.airbnb.com/rooms/8522149,20220919000909,2022-09-19,city scrape,You are my sunshine room,"We are located in a quiet cul de sac with easy access to I-5, Keizer Station and downtown. The room features a queen size bed--super comfy. The bedding includes down pillows and a down comforter. There is an adjacent space with an office--place to hook up your computer and we offer complimentary wifi service for all of our guests. We have a 2 cats that are friendly but will stay out of your room--maybe. Our room includes a mini fridge, microwave, Kuerig coffee maker and coffee supplies<br /><br /><b>The space</b><br />Clean home & great hosts<br /><br /><b>Guest access</b><br />Bathroom, kitchen, living room & laundry. Also have an outdoor hot tub that guests are welcome to use.<br /><br /><b>Other things to note</b><br />We have a kitty that won't access your room if you don’t want her to<br /><br />Please no smoking or vaping in the room. You’re welcome to use the back deck.",We live on a quiet cul de sac,https://a0.muscache.com/pictures/3242a9a5-8de8-46cd-81c9-dc46c40151a6.jpg,35031501,https://www.airbnb.com/users/show/35031501,Shelley,2015-06-04,"Salem, OR",NA,within an hour,100%,93%,TRUE,https://a0.muscache.com/im/pictures/user/f6d278eb-adec-475f-adae-4c1eb3ddd7d7.jpg?aki_policy=profile_small,https://a0.muscache.com/im/pictures/user/f6d278eb-adec-475f-adae-4c1eb3ddd7d7.jpg?aki_policy=profile_x_medium,NA,2,2,"['email', 'phone', 'work_email']",TRUE,TRUE,"Salem, Oregon, United States",Ward 6,NA,44.97051,-122.96244,Private room in home,Private room,2,NA,1 shared bath,1,1,"[""Essentials"", ""Cable TV"", ""Portable fans"", ""Hot water kettle"", ""Safe"", ""Bed linens"", ""Mini fridge"", ""Toaster"", ""Room-darkening shades"", ""Children\u2019s books and toys"", ""Ceiling fan"", ""Refrigerator"", ""Luggage dropoff allowed"", ""Dining table"", ""Heating"", ""Shampoo"", ""Freezer"", ""Shower gel"", ""Hair dryer"", ""Outdoor dining area"", ""Long term stays allowed"", ""Bathtub"", ""Lockbox"", ""Hangers"", ""Conditioner"", ""Clothing storage: dresser and closet"", ""High chair"", ""Private hot tub"", ""Fast wifi \u2013 387 Mbps"", ""Stove"", ""Indoor fireplace"", ""Barbecue utensils"", ""Bread maker"", ""Washer"", ""Cooking basics"", ""Oven"", ""Kitchen"", ""Air conditioning"", ""Dishes and silverware"", ""Smoke alarm"", ""Free street parking"", ""Wine glasses"", ""Microwave"", ""Fire extinguisher"", ""Fire pit"", ""BBQ grill"", ""Iron"", ""Board games"", ""Keurig coffee machine"", ""Rice maker"", ""Carbon monoxide alarm"", ""Hot water"", ""Dryer"", ""Baking sheet"", ""Single level home"", ""Outdoor furniture"", ""Private garden or backyard"", ""Body soap"", ""Coffee maker"", ""Cleaning products"", ""TV with standard cable"", ""Extra pillows and blankets"", ""Dishwasher""]",$49.00,2,1125,2,2,1125,1125,2,1125,NA,TRUE,12,24,45,314,2022-09-19,93,21,1,2015-10-26,2022-08-24,4.92,4.97,4.93,4.92,4.96,4.86,4.95,NA,FALSE,2,0,2,0,1.11,salem,MA
8524259,https://www.airbnb.com/rooms/8524259,20220919000909,2022-09-19,city scrape,Single room in Comfort Home,"Comfort Home was initially established for traveling medical professionals for Salem Health where I am the Clinical Excellence Coordinator. I provide discounts to RNs and other disciplines.  I also rent to diverse guests and have enjoyed learning from everyone I've met.  This home is perfect for sharing as I live in one section, the rooms are on the opposite side and our common space is perfect for everyone.  I look forward to interacting should you be interested in making a request.<br /><br /><b>The space</b><br />Two rental rooms share a very large full bathroom with both tub and shower.  One room has a private half bathroom.  Guests share the grand room with living, dining and kitchen surrounding a three-sided gas fireplace.  Guest can use home gym, backyard with hot tub and barbecue.  The kitchen is designed for cooking and will share small amounts of condiments, spices and other items used for cooking.  My space is on opposite side of house, upstairs and private.  <br /><br />Sel","Well established high end neighborhood with very friendly neighbors. Located on a cul-de-sac with adequate parking and little traffic so it is very quiet.  Feels like a mountain resort due to the large and dense oak and pine trees.  Back yard opens into quiet and beautiful neighborhood park.  <br /><br />10 minutes from I-5<br />Sunnyslope Shopping Center is a short walk from my home and has a wonderful grocery store (Roth's), U.S. Bank, restaurants, frozen yogurt shop, hair and nail salon, and more. Also within walking distance is a Walgreens, post office, gift shop and bakery.  4 miles from downtown Salem.  Blocks from gas station.",https://a0.muscache.com/pictures/948454d8-c934-4037-9ca8-a7ce44b30259.jpg,2421461,https://www.airbnb.com/users/show/2421461,Nancy,2012-05-20,"Salem, OR","I have lived in this home 21 years and have truly made it comfortable to both me and my guests.  The house is perfectly designed to accommodate guests as we built the 2-story extension that I live in upstairs which provides privacy for both myself and my guests.  My guests and I commonly share the downstairs which includes the kitchen, dining and living room, gym and back yard where there is a hot tub.",within a few hours,100%,0%,FALSE,https://a0.muscache.com/im/pictures/user/a4ab6d28-1f6d-4e58-be41-4f64594048da.jpg?aki_policy=profile_small,https://a0.muscache.com/im/pictures/user/a4ab6d28-1f6d-4e58-be41-4f64594048da.jpg?aki_policy=profile_x_medium,NA,3,3,"['email', 'phone']",TRUE,FALSE,"Salem, Oregon, United States",Ward 7,NA,44.89105,-123.06843,Private room in home,Private room,1,NA,1 shared bath,1,1,"[""Free parking on premises"", ""Essentials"", ""Host greets you"", ""Hair dryer"", ""Hot water"", ""Carbon monoxide alarm"", ""Security cameras on property"", ""Private entrance"", ""Long term stays allowed"", ""Smoke alarm"", ""Free street parking"", ""TV"", ""Fire extinguisher"", ""Wifi"", ""Shampoo""]",$65.00,1,90,1,1,90,90,1,90,NA,TRUE,0,0,17,291,2022-09-19,3,0,0,2017-08-21,2021-04-21,5,5,5,5,5,5,5,NA,FALSE,2,0,2,0,0.05,salem,MA
8698684,https://www.airbnb.com/rooms/8698684,20220919000909,2022-09-19,city scrape,Charming 1925 Craftsman centrally located!,"The State Capitol, Salem's favorite breakfast spot (Word of Mouth), Willamette University, Salem Hospital and downtown are all close by! The inside of this nearly one hundred year old Craftsman house has a comfortable charm with a mix of old and new style. Three bedrooms, dining/family room, sunporch full of books and plants, huge backyard for pets, fire pit and pool. We request $10 extra per night per dog (max $50 and no other animals) for cleaning purposes. City of Salem license: #22-101136-LI<br /><br /><b>The space</b><br />This is a 1925 Craftsman home that has stood the test of time. Settled in an older part of Salem, the house has a charm and comfort for most to enjoy. The house sits on a double lot, leaving lots of room to play and enjoy the outside on nice days. We have a front sunporch and a patio outside with a firepit (and PLENTY of wood!). Our 32'x16' swimming pool will be up in summer months with good weather conditions. If you would like to see specifics on two of the be","We love our neighbors and our neighborhood. Tree-lined streets, sidewalks, and quiet. We love how central it is to most things in Salem. And we love how central Salem is to most things in western Oregon. The neighborhood and Salem is overall very safe but cars have had things disappear when people forget to lock!",https://a0.muscache.com/pictures/5a056d03-cf09-4c0d-a1b9-f0e81e2a0530.jpg,3208932,https://www.airbnb.com/users/show/3208932,Christy,2012-08-09,"Salem, OR","I co-host with my husband Arnaud. I'll be the communicator online, he takes care of the rest (cleaning, problem solving:). We took a pause from March 2020-October 2021 but now we are back, both of us vaccinated and boosted.

We enjoy traveling to different countries, mostly to know the people who live there. It just so happened that Christy traveled to Europe in 2015 and met Arnaud in Belgium. 

We have been renting our house to commuters and friends for over 10 years (even before Airbnb) so we are very used to shared spaces/renting private rooms. When we travel (as we like to a lot), we rent out the entire house. Music and learning and relationships are other passions in life. 

In 2019, we launched a GPS-enabled Oregon audio tours business  called Together Anywhere. Let us know if you want to know more!",within an hour,100%,99%,TRUE,https://a0.muscache.com/im/pictures/user/c4429fc8-2393-434e-8120-e56ae4f209d4.jpg?aki_policy=profile_small,https://a0.muscache.com/im/pictures/user/c4429fc8-2393-434e-8120-e56ae4f209d4.jpg?aki_policy=profile_x_medium,NA,3,3,"['email', 'phone', 'work_email']",TRUE,TRUE,"Salem, Oregon, United States",Ward 2,NA,44.93305,-123.01985,Entire home,Entire home/apt,6,NA,1 bath,3,3,"[""Essentials"", ""Private entrance"", ""Bed linens"", ""Free washer \u2013 In building"", ""Room-darkening shades"", ""Central air conditioning"", ""Fast wifi \u2013 106 Mbps"", ""Children\u2019s books and toys"", ""Refrigerator"", ""Luggage dropoff allowed"", ""Heating"", ""Shampoo"", ""Hair dryer"", ""Long term stays allowed"", ""Bathtub"", ""Lockbox"", ""Hangers"", ""Cleaning before checkout"", ""Stove"", ""55\"" HDTV with Apple TV, Netflix, Roku"", ""Dedicated workspace"", ""Cooking basics"", ""Security cameras on property"", ""Oven"", ""Free dryer \u2013 In building"", ""Kitchen"", ""Private fenced garden or backyard"", ""Dishes and silverware"", ""Smoke alarm"", ""First aid kit"", ""Free street parking"", ""Microwave"", ""Fire extinguisher"", ""BBQ grill"", ""Iron"", ""Private patio or balcony"", ""Free parking on premises"", ""Carbon monoxide alarm"", ""Hot water"", ""Coffee maker"", ""Extra pillows and blankets"", ""Dishwasher""]",$225.00,3,31,3,5,1125,1125,3.1,1125,NA,TRUE,0,0,18,52,2022-09-19,88,8,0,2015-12-27,2022-08-04,4.79,4.82,4.53,4.94,4.98,4.89,4.8,NA,TRUE,3,1,2,0,1.07,salem,MA
