54187528,https://www.airbnb.com/rooms/54187528,20220919000909,2022-09-19,city scrape,Shannon T’s Airbnb,"The whole group will enjoy easy access to everything from this centrally located place.  Pet friendly.<br /><br /><b>The space</b><br />Upstairs are the rooms available and there is currently no wheelchair access.  Work is still being done on the home.  Newly painted front porch and new fence.  <br />Smoking is allowed on front porch and coffee, tea and cereal bars are available upon requests.<br /><br /><b>Guest access</b><br />We are walking distance to the state capital, buses, Uber and Lyft are easy access.  Parking can be six or seven cars away from the house or for an additional fee of $35.00 a day we can have you park in the back yard.<br /><br /><b>Other things to note</b><br />Sheets/Linens/towels will be available clean and fresh for new guests and we will provide new clean towels and sheets for guest that stay more than three days or make special requests for a small additional fee of $20.00","Some good restaurants of Sushi, Korean, Chinese, Italian, Vegan Bowls, unique food and Better than Your Mamas Food a few minutes away.  We have everything close by!",https://a0.muscache.com/pictures/f7c39bff-4eb8-4242-9f7d-ad99694f7cf8.jpg,64250240,https://www.airbnb.com/users/show/64250240,Shannon,2016-03-23,"Salem, OR","We enjoy meeting people and serving them.  I am a Busy woman with an Eclectic background of many volunteerism in overseas and this country.  A Jane of all trades and interesting personalities are a favorite of mine.  My favorite subject is Cognitive Science.  Princess, Martin and I love to meet people and hear their stories or just allow them to relax.  We are flexible with the guests and like to help people have a wonderful trip wherever they are.  Martin is a behavior specialist and entrepreneur.  His favorite subjects are football and professional fighters.  We like nature, hiking, travel, good food,  and movies.",within an hour,100%,100%,FALSE,https://a0.muscache.com/im/pictures/user/fd408b3d-eb44-42c3-a943-04b640bf921e.jpg?aki_policy=profile_small,https://a0.muscache.com/im/pictures/user/fd408b3d-eb44-42c3-a943-04b640bf921e.jpg?aki_policy=profile_x_medium,Grant,2,2,"['email', 'phone']",TRUE,TRUE,"Salem, Oregon, United States",Ward 1,NA,44.95117,-123.02681,Private room in home,Private room,2,NA,1.5 shared baths,1,2,"[""Essentials"", ""Portable fans"", ""Hot water kettle"", ""Bed linens"", ""Mini fridge"", ""Toaster"", ""Room-darkening shades"", ""Luggage dropoff allowed"", ""Wifi"", ""Dining table"", ""Freezer"", ""Shower gel"", ""Hair dryer"", ""Outdoor dining area"", ""Paid parking lot on premises \u2013 2 spaces"", ""Long term stays allowed"", ""Bathtub"", ""Paid washer \u2013 In building"", ""Hangers"", ""Laundromat nearby"", ""Cleaning before checkout"", ""Suave and Enjoy conditioner"", ""Amana oven"", ""Barbecue utensils"", ""TV"", ""Galant refrigerator"", ""Dedicated workspace"", ""Cooking basics"", ""Radio and TV sound system"", ""Suave and Enjoy shampoo"", ""Kirkland and Nivea body soap"", ""Central heating"", ""Kitchen"", ""Air conditioning"", ""Dishes and silverware"", ""Smoke alarm"", ""Private fenced garden or backyard"", ""First aid kit"", ""Drying rack for clothing"", ""Wine glasses"", ""Microwave"", ""Free street parking"", ""Fire extinguisher"", ""Amana electric stove"", ""BBQ grill"", ""Iron"", ""Board games"", ""Pour-over coffee"", ""Keurig coffee machine"", ""Private patio or balcony"", ""Carbon monoxide alarm"", ""Hot water"", ""Dryer"", ""Portable heater"", ""Baking sheet"", ""Outdoor furniture"", ""Beach essentials"", ""Coffee maker"", ""Cleaning products"", ""Extra pillows and blankets"", ""Dishwasher""]",$99.00,1,1125,1,1,1125,1125,1,1125,NA,TRUE,30,60,89,89,2022-09-19,1,1,0,2022-03-03,2022-03-03,5,5,5,5,5,5,5,NA,TRUE,2,0,2,0,0.15,salem,MA
54248038,https://www.airbnb.com/rooms/54248038,20220919000909,2022-09-19,city scrape,Newly Remodeled 2 BR Guest Suite w/ beautiful view,"Enjoy your stay in my quiet newly remodeled 2 bedroom large guest suite. Private entrance and space. This house sits above central Salem with beautiful views of the city and the surrounding valley & mountains. Enjoy the views from the expansive deck or the large windows in the great room. Peaceful and private neighborhood, the guest suite is the upper part of my large family house of 45 years. Lots of room. Sleeps up to 8, with 2 private BR w/new king beds and 2 new sleeper sofas. Lots of charm.<br /><br /><b>The space</b><br />Newly remodeled with lots of unique family heirlooms. You have total privacy in my large guest suite located in the upper part of my split level house.  Private Entrance. No host self check in.  2 bedrooms with King Beds , a large living room with 2 sleeper sofas, a large dining room, a full bathroom, and a sizable kitchen with all your cooking needs. Also enjoy a large expansive deck with table, chairs and BBQ.  Beautiful views of the city and surrounding valle",Quiet and private neighborhood sitting just above Central Salem with views of the city and surrounding valley and mountains.,https://a0.muscache.com/pictures/75d6924e-2f69-4b32-a43e-4d970ea939db.jpg,89910661,https://www.airbnb.com/users/show/89910661,Brian,2016-08-14,"Salem, OR",NA,within an hour,100%,100%,TRUE,https://a0.muscache.com/im/pictures/user/298eb220-1845-4774-a6e6-ca1fff8e6200.jpg?aki_policy=profile_small,https://a0.muscache.com/im/pictures/user/298eb220-1845-4774-a6e6-ca1fff8e6200.jpg?aki_policy=profile_x_medium,South Central,1,1,"['email', 'phone']",TRUE,TRUE,"Salem, Oregon, United States",Ward 2,NA,44.917164,-123.039185,Entire home,Entire home/apt,8,NA,1 bath,2,4,"[""Essentials"", ""Hot water kettle"", ""Private entrance"", ""Bluetooth sound system"", ""Radiant heating"", ""Toaster"", ""Room-darkening shades"", ""Stainless steel oven"", ""Refrigerator"", ""50\"" HDTV with Roku"", ""Luggage dropoff allowed"", ""Wifi"", ""Dining table"", ""Shampoo"", ""Freezer"", ""Electric stove"", ""Shower gel"", ""Hair dryer"", ""Outdoor dining area"", ""Bathtub"", ""Hangers"", ""Conditioner"", ""Clothing storage: dresser and closet"", ""Barbecue utensils"", ""Indoor fireplace"", ""Dedicated workspace"", ""AC - split type ductless system"", ""Smart lock"", ""Cooking basics"", ""Central heating"", ""Kitchen"", ""Fireplace guards"", ""Smoke alarm"", ""Baby safety gates"", ""First aid kit"", ""Dishes and silverware"", ""Free street parking"", ""Microwave"", ""Fire extinguisher"", ""BBQ grill"", ""Iron"", ""Private patio or balcony"", ""Free parking on premises"", ""Piano"", ""Single level home"", ""Baking sheet"", ""Outdoor furniture"", ""Private garden or backyard"", ""Body soap"", ""Coffee maker"", ""Cleaning products"", ""Extra pillows and blankets"", ""Dishwasher""]",$95.00,2,7,2,2,1125,1125,2,1125,NA,TRUE,18,35,53,308,2022-09-19,28,28,3,2022-04-03,2022-09-10,5,5,5,4.96,5,4.96,5,NA,TRUE,1,1,0,0,4.94,salem,MA
54298128,https://www.airbnb.com/rooms/54298128,20220919000909,2022-09-19,previous scrape,Spacious and bright private master bedroom.,"Forget your worries in this spacious and serene space. Light and bright master suite with private bathroom.<br /><br /><b>The space</b><br />Whole home was recently renovated including all new windows, interior paint, new flooring, refinished original hardwood floors, brand new furniture including mattresses and bedding, all new kitchen appliances and many other features. Conveniently located near multiple grocery stores, restaurants and a 5 minute drive to freeway access, 10 minutes to downtown and Salem Hospital.",NA,https://a0.muscache.com/pictures/miso/Hosting-54298128/original/87d64293-f770-4b32-8e62-327301908ce2.jpeg,438086831,https://www.airbnb.com/users/show/438086831,Oleg,2021-12-29,NA,NA,within a day,50%,74%,TRUE,https://a0.muscache.com/im/pictures/user/ba55a170-a32e-46c5-ae1d-ff1a30403a71.jpg?aki_policy=profile_small,https://a0.muscache.com/im/pictures/user/ba55a170-a32e-46c5-ae1d-ff1a30403a71.jpg?aki_policy=profile_x_medium,Faye Wright,4,4,['phone'],TRUE,FALSE,NA,Ward 7,NA,44.88969,-123.04987,Private room in home,Private room,2,NA,2 baths,1,1,"[""Essentials"", ""Bed linens"", ""Stainless steel oven"", ""Refrigerator"", ""Wifi"", ""Freezer"", ""Hair dryer"", ""Long term stays allowed"", ""Lockbox"", ""Hangers"", ""Outlet covers"", ""Stove"", ""TV"", ""Cooking basics"", ""Central heating"", ""Kitchen"", ""Air conditioning"", ""Dishes and silverware"", ""Smoke alarm"", ""Private fenced garden or backyard"", ""First aid kit"", ""Microwave"", ""Fire extinguisher"", ""Iron"", ""Free parking on premises"", ""Carbon monoxide alarm"", ""Hot water"", ""Lock on bedroom door"", ""Cleaning products"", ""Dishwasher""]",$65.00,2,1125,2,2,1125,1125,2,1125,NA,TRUE,0,0,0,0,2022-09-19,5,5,0,2022-01-16,2022-05-16,5,5,5,5,5,5,5,NA,FALSE,4,1,3,0,0.61,salem,MA
54298325,https://www.airbnb.com/rooms/54298325,20220919000909,2022-09-19,previous scrape,Warm and welcoming private bedroom.,"Forget your worries in this spacious and serene space. Conveniently located near shopping, 5 minute drive to freeway and 10 minutes downtown. Whole home was recently fully renovated with all new flooring, paint, appliances, etc.",NA,https://a0.muscache.com/pictures/miso/Hosting-54298325/original/04c56fd2-d5da-47d1-ba83-fb6fb49b8831.jpeg,438086831,https://www.airbnb.com/users/show/438086831,Oleg,2021-12-29,NA,NA,within a day,50%,74%,TRUE,https://a0.muscache.com/im/pictures/user/ba55a170-a32e-46c5-ae1d-ff1a30403a71.jpg?aki_policy=profile_small,https://a0.muscache.com/im/pictures/user/ba55a170-a32e-46c5-ae1d-ff1a30403a71.jpg?aki_policy=profile_x_medium,Faye Wright,4,4,['phone'],TRUE,FALSE,NA,Ward 7,NA,44.89027,-123.04978,Private room in home,Private room,2,NA,1 shared bath,1,1,"[""Essentials"", ""Bed linens"", ""Wifi"", ""Hair dryer"", ""Long term stays allowed"", ""Bathtub"", ""Lockbox"", ""Hangers"", ""Outlet covers"", ""TV"", ""Dedicated workspace"", ""Cooking basics"", ""Central heating"", ""Kitchen"", ""Air conditioning"", ""Dishes and silverware"", ""Smoke alarm"", ""First aid kit"", ""Fire extinguisher"", ""Iron"", ""Free parking on premises"", ""Clothing storage: closet"", ""Hot water"", ""Carbon monoxide alarm"", ""Lock on bedroom door"", ""Cleaning products""]",$61.00,2,1125,2,2,1125,1125,2,1125,NA,TRUE,0,0,0,0,2022-09-19,3,3,0,2022-02-11,2022-05-01,5,4.67,5,5,5,5,5,NA,FALSE,4,1,3,0,0.41,salem,MA
54375906,https://www.airbnb.com/rooms/54375906,20220919000909,2022-09-19,city scrape,Entire 4Bedroom Home in Downtown Salem,"Beautiful historical home with updated modern amenities conveniently located mins from downtown Salem, hospital, Oregon State Capital and Willamette University.  The spacious 4 bedroom / 3 bathroom home has a fenced lot with parking for up to six cars. Home features industrial carpet floors throughout, ventless gas fireplace in living room, laundry in basement, updated kitchen with newer dishwasher & refrigerator. Main bedroom with en suite walk-in shower and double sinks.<br /><br /><b>The space</b><br />Amazing 4-bedroom two story home is on a 1/4 acre private lot with parking for up to six cars. The spacious home is Steps to restaurants, shopping, school and parks! Open layout with hardwoods, updated kitchen and bathrooms.<br /><br /><b>Guest access</b><br />Guests have access to the entire house.<br /><br /><b>Other things to note</b><br />This spacious home is designed to be your home away from home.","We are in the heart of Oregon. Family oriented communities, historical homes, close to Riverfront Park, state capital, downtown, state hospital.",https://a0.muscache.com/pictures/miso/Hosting-54375906/original/5e79a75f-b9f7-4dfb-b306-7c2f1b828fe8.jpeg,378870814,https://www.airbnb.com/users/show/378870814,Steeves,2020-12-08,NA,NA,within a few hours,100%,93%,FALSE,https://a0.muscache.com/im/pictures/user/70ea7e72-464a-4774-8a2e-96a1e8a054c0.jpg?aki_policy=profile_small,https://a0.muscache.com/im/pictures/user/70ea7e72-464a-4774-8a2e-96a1e8a054c0.jpg?aki_policy=profile_x_medium,Northeast Neighbors,1,4,"['email', 'phone']",TRUE,TRUE,"Salem, Oregon, United States",Ward 2,NA,44.93443,-123.02011,Entire home,Entire home/apt,4,NA,3 baths,4,4,"[""Essentials"", ""EV charger"", ""Refrigerator"", ""42\"" HDTV with Netflix"", ""Wifi"", ""Heating"", ""Shampoo"", ""Free dryer \u2013 In unit"", ""Hair dryer"", ""Long term stays allowed"", ""Lockbox"", ""Hangers"", ""Indoor fireplace"", ""Dedicated workspace"", ""Window AC unit"", ""Security cameras on property"", ""Breakfast"", ""Free washer"", ""Kitchen"", ""Dishes and silverware"", ""Smoke alarm"", ""First aid kit"", ""Fire extinguisher"", ""Iron"", ""Private patio or balcony"", ""Free parking on premises"", ""Carbon monoxide alarm"", ""Private garden or backyard"", ""Coffee maker""]",$214.00,1,1125,1,1,1125,1125,1,1125,NA,TRUE,7,14,29,118,2022-09-19,9,9,2,2022-04-20,2022-08-25,5,5,5,4.89,5,5,5,NA,FALSE,1,1,0,0,1.76,salem,MA
498561342251699900,https://www.airbnb.com/rooms/498561342251699887,20220919000909,2022-09-19,city scrape,Blissful Getaway,"Take it easy at this unique and tranquil getaway. Full of light and love bringing home to you whenever your in town. In a gorgeous neighborhood with lots of lush gardens all around... the best place to get lost in a book or the blankets with your loved ones, family and friends. Perfect any family size, offering plenty of space for work, play, relaxing, and everything in between. Make your getaway exceptionally unforgettable.<br /><br /><b>The space</b><br />Heaven, it's a slice of heaven. Happy to share are hard work and dream home with you and your loved ones. A most comfortable and cozy place to nestle in and enjoy the rain or sunny days. Sitting on the deck and enjoying the nature around you'll forget your even in town. <br />A place you can call home.","Very peaceful neighborhood, not a through street so no traffic going through, keeps it very safe and secluded. <br />We have the only fully fenced front yard on the street for complete privacy.",https://a0.muscache.com/pictures/d9ef5ff0-0b26-43f5-b76d-58104e726b02.jpg,345707876,https://www.airbnb.com/users/show/345707876,Monique,2020-05-08,"Redding, CA","Small town lifestyle living it up in a big world, adventurous souls trying to share our home with like minded people. 
",within an hour,100%,100%,FALSE,https://a0.muscache.com/im/pictures/user/f290d290-c1d4-4051-bd55-96ce5143ae67.jpg?aki_policy=profile_small,https://a0.muscache.com/im/pictures/user/f290d290-c1d4-4051-bd55-96ce5143ae67.jpg?aki_policy=profile_x_medium,NA,1,1,['phone'],TRUE,TRUE,"Keizer, Oregon, United States",Ward 5,NA,44.98837,-123.02161,Entire home,Entire home/apt,8,NA,1.5 baths,3,4,"[""Essentials"", ""Portable fans"", ""Safe"", ""Bed linens"", ""Toaster"", ""Room-darkening shades"", ""Ceiling fan"", ""Refrigerator"", ""Luggage dropoff allowed"", ""Wifi"", ""Dining table"", ""Heating"", ""Shampoo"", ""Freezer"", ""Record player"", ""Children\u2019s books and toys for ages 5-10 years old"", ""Electric stove"", ""Shower gel"", ""Long term stays allowed"", ""Outdoor dining area"", ""Bathtub"", ""Cleaning products"", ""Hangers"", ""Conditioner"", ""Clothing storage: dresser and closet"", ""Laundromat nearby"", ""Lockbox"", ""TV"", ""Indoor fireplace"", ""Dedicated workspace"", ""Dove body soap"", ""Washer"", ""Cooking basics"", ""Security cameras on property"", ""Oven"", ""Kitchen"", ""Air conditioning"", ""Fireplace guards"", ""Smoke alarm"", ""Dishes and silverware"", ""Private fenced garden or backyard"", ""Free street parking"", ""Wine glasses"", ""Microwave"", ""Fire pit"", ""Iron"", ""Board games"", ""Private patio or balcony"", ""Free parking on premises"", ""Rice maker"", ""Carbon monoxide alarm"", ""Hot water"", ""Dryer"", ""Baking sheet"", ""Single level home"", ""Outdoor furniture"", ""Coffee maker"", ""Sound system"", ""Extra pillows and blankets"", ""Dishwasher""]",$121.00,1,1125,1,1,1125,1125,1,1125,NA,TRUE,17,41,71,330,2022-09-19,20,20,7,2022-06-01,2022-09-14,4.8,4.85,4.85,4.95,5,4.8,4.8,NA,FALSE,1,1,0,0,5.41,salem,MA
554979564451017e3,https://www.airbnb.com/rooms/554979564451017024,20220919000909,2022-09-19,city scrape,UPSTAIRS 1 Bedroom Unit with Creek View,"Upstairs-  THIS IS A NEW LISTING using the pictures of the unit directly below this to show layout.  The setup will be identical except carpet not hardwood floors<br /><br />Over 700 SF! Sunny and bright ONE large bedroom, bathroom, full kitchen, large living room, Creekside condo just blocks from downtown Salem. Wonderful view of historic Mill Creek and large balcony overlooking the creek. Reserved parking . 4 blocks from Salem Center Mall, five blocks from State Capital and 7 from Willamette University.<br /><br /><b>The space</b><br />Upstairs-  THIS IS A NEW LISTING using the pictures of the unit directly below this to show layout.  The setup will be identical except carpet not hardwood floors<br /><br />Over 700 SF! Sunny and bright ONE large bedroom, bathroom, full kitchen, large living room, Creekside condo just blocks from downtown Salem. Wonderful view of historic Mill Creek and large balcony overlooking the creek. Reserved parking . 4 blocks from Salem Center Mall, five block",NA,https://a0.muscache.com/pictures/miso/Hosting-554979564451017024/original/e3962f4b-b369-4c20-8ef2-59752975c4c3.jpeg,142420980,https://www.airbnb.com/users/show/142420980,Amanda,2017-07-25,"Oregon, United States",Love to travel and spend time with my family and our dog!  Grew up in Oregon and loved coming back after college.,within an hour,100%,100%,TRUE,https://a0.muscache.com/im/pictures/user/69d78130-dfa0-4188-af78-45f552afa65f.jpg?aki_policy=profile_small,https://a0.muscache.com/im/pictures/user/69d78130-dfa0-4188-af78-45f552afa65f.jpg?aki_policy=profile_x_medium,Central Area,8,11,"['email', 'phone', 'work_email']",TRUE,TRUE,NA,Ward 1,NA,44.94746,-123.03293,Entire rental unit,Entire home/apt,3,NA,1 bath,1,1,"[""Essentials"", ""Keypad"", ""Private entrance"", ""Bed linens"", ""Wifi"", ""Heating"", ""Shampoo"", ""Hair dryer"", ""Long term stays allowed"", ""Hangers"", ""TV"", ""Dedicated workspace"", ""Cooking basics"", ""Extra pillows and blankets"", ""Kitchen"", ""Air conditioning"", ""Dishes and silverware"", ""Smoke alarm"", ""First aid kit"", ""Microwave"", ""Fire extinguisher"", ""Iron"", ""Free parking on premises"", ""Carbon monoxide alarm"", ""Dryer"", ""Hot water"", ""Coffee maker""]",$75.00,30,1125,30,30,1125,1125,30,1125,NA,TRUE,0,0,0,229,2022-09-19,2,2,0,2022-04-01,2022-07-14,5,5,3.5,5,5,5,4,NA,TRUE,7,7,0,0,0.35,salem,MA
565639133635114900,https://www.airbnb.com/rooms/565639133635114859,20220919000909,2022-09-19,city scrape,Mod Farmhouse vibe; spacious and beautiful!,"3rd Generation Farmhouse is 4600 sq ft home that is bright, airy and features a spacious open concept with beautiful terrestrial views! <br />Main floor offers large gourmet kitchen, family room, formal living room w/ gas fireplace, study, laundry room and guest bathroom.<br />Upstairs: 4 bedrooms, 2 bedrooms are adjoined by a Jack and Jill bathroom. The master suite and 4 th bedroom have ensuite bathrooms.<br /><br /><b>The space</b><br />It’s more than a home, it’s an adventure. Great farmhouse vibe in a beautiful/ safe neighborhood. There is plenty of space to stretch out, laugh, relax and create wonderful memories.<br /><br /><b>Guest access</b><br />Hassle free check in. Driveway and street parking available. Driveway has room for 5 cars.<br /><br /><b>Other things to note</b><br />Please remove shoes when entering home.<br />No smoking on premises",Beautiful and safe neighborhood. Take a walk around the neighborhood or Minto Brown is 1.5 miles away.,https://a0.muscache.com/pictures/c2502555-25cd-4228-bac8-68c7ba597f89.jpg,45044784,https://www.airbnb.com/users/show/45044784,Debbie,2015-09-25,"Salem, OR",NA,within an hour,100%,99%,TRUE,https://a0.muscache.com/im/users/45044784/profile_pic/1443157769/original.jpg?aki_policy=profile_small,https://a0.muscache.com/im/users/45044784/profile_pic/1443157769/original.jpg?aki_policy=profile_x_medium,South Salem,4,4,"['email', 'phone']",TRUE,TRUE,"Salem, Oregon, United States",Ward 7,NA,44.91348,-123.06555,Entire home,Entire home/apt,8,NA,3.5 baths,4,4,"[""Essentials"", ""Hot water kettle"", ""Private entrance"", ""Safe"", ""Bed linens"", ""Ethernet connection"", ""Toaster"", ""Room-darkening shades"", ""Central air conditioning"", ""Stainless steel oven"", ""Stainless steel gas stove"", ""Ceiling fan"", ""Refrigerator"", ""Wifi"", ""Dining table"", ""Shampoo"", ""Freezer"", ""Free dryer \u2013 In unit"", ""Shower gel"", ""Hair dryer"", ""Outdoor dining area"", ""Long term stays allowed"", ""70\"" HDTV with "", ""Bathtub"", ""Hangers"", ""Conditioner"", ""High chair"", ""Barbecue utensils"", ""Indoor fireplace"", ""Dedicated workspace"", ""Cooking basics"", ""Security cameras on property"", ""Central heating"", ""Kitchen"", ""Dishes and silverware"", ""Smoke alarm"", ""First aid kit"", ""Wine glasses"", ""Microwave"", ""Fire extinguisher"", ""Fire pit"", ""Free washer \u2013 In unit"", ""Iron"", ""Board games"", ""BBQ grill"", ""Private patio or balcony"", ""Free parking on premises"", ""Piano"", ""Rice maker"", ""Carbon monoxide alarm"", ""Hot water"", ""Baking sheet"", ""Body soap"", ""Cleaning products"", ""Coffee maker"", ""Dishwasher""]",$607.00,2,30,2,2,1125,1125,2,1125,NA,TRUE,11,37,62,326,2022-09-19,10,10,3,2022-04-24,2022-09-12,5,5,5,5,5,5,5,NA,FALSE,3,2,1,0,2.01,salem,MA
570356863947805950,https://www.airbnb.com/rooms/570356863947805933,20220919000909,2022-09-19,city scrape,QUIMBY COTTAGE,"Welcome to Quimby Cottage!  A quiet & cozy cottage style home away from home.  Relaxing living area, full modern kitchen, 2 bedroom and bath.  Spacious front porch - the perfect place to unwind.  Landscaped yard with gated entry.<br /><br /><b>The space</b><br />Peaceful, quiet, magical.","Quiet, peaceful and friendly!",https://a0.muscache.com/pictures/miso/Hosting-570356863947805933/original/1f15584b-a054-4e3b-b2e1-c93317e1e0a0.jpeg,142891274,https://www.airbnb.com/users/show/142891274,Marie,2017-07-27,"Salem, OR",NA,a few days or more,0%,100%,FALSE,https://a0.muscache.com/im/pictures/user/2bb22ff0-114b-4f98-a660-65e58216a0b8.jpg?aki_policy=profile_small,https://a0.muscache.com/im/pictures/user/2bb22ff0-114b-4f98-a660-65e58216a0b8.jpg?aki_policy=profile_x_medium,Lansing,1,1,"['email', 'phone']",TRUE,FALSE,"Salem, Oregon, United States",Ward 5,NA,44.95643,-123.00137,Entire cottage,Entire home/apt,2,NA,1 bath,2,2,"[""Free parking on premises"", ""Host greets you"", ""Hair dryer"", ""Dryer"", ""Carbon monoxide alarm"", ""Backyard"", ""Outdoor dining area"", ""Long term stays allowed"", ""Kitchen"", ""Air conditioning"", ""Patio or balcony"", ""Smoke alarm"", ""TV"", ""Refrigerator"", ""Fire extinguisher"", ""Wifi"", ""Heating"", ""Dedicated workspace""]",$82.00,30,365,30,30,365,365,30,365,NA,TRUE,0,0,15,289,2022-09-19,1,1,0,2022-03-06,2022-03-06,5,5,5,5,5,5,5,NA,TRUE,1,1,0,0,0.15,salem,MA
571217279528206500,https://www.airbnb.com/rooms/571217279528206547,20220919000909,2022-09-19,city scrape,Craftsman Cottage 18th NE Hosted by Salemstays.com,"Our lovely three bedroom Craftsman's Cottage is now available to you, your family and friends as a vacation rental in Salem Oregon. Our house is centrally located and lovely adorned. It is comfortable and peaceful, on a tree lined street with wonderful neighbors and colorful welcoming doors you are close to Downtown, Willamette University, State Capital & the fairgrounds you could not be more centrally located. Your family will be close to everything when you stay at this centrally located house<br /><br /><b>Guest access</b><br />As we get closer to your stay I will send you a check in video to your cell and your cost to self-check in.<br /><br /><b>Other things to note</b><br />You can always find me at Salemstays.com",NA,https://a0.muscache.com/pictures/cf402210-c239-4d5d-8175-358607600b75.jpg,407581863,https://www.airbnb.com/users/show/407581863,Angela,2021-06-17,"Salem, OR",You can reach me at Salemstays,within an hour,100%,97%,TRUE,https://a0.muscache.com/im/pictures/user/c31c9916-717d-4a32-af8d-b71a8d7d957b.jpg?aki_policy=profile_small,https://a0.muscache.com/im/pictures/user/c31c9916-717d-4a32-af8d-b71a8d7d957b.jpg?aki_policy=profile_x_medium,Northeast Neighbors,34,36,"['email', 'phone']",TRUE,TRUE,NA,Ward 1,NA,44.951057,-123.010674,Entire home,Entire home/apt,5,NA,1 bath,3,3,"[""Essentials"", ""Keypad"", ""Private entrance"", ""Radiant heating"", ""Bed linens"", ""Toaster"", ""Central air conditioning"", ""Ceiling fan"", ""Refrigerator"", ""Luggage dropoff allowed"", ""Wifi"", ""Shampoo"", ""Freezer"", ""Free dryer \u2013 In unit"", ""Electric stove"", ""Hair dryer"", ""Outdoor dining area"", ""Long term stays allowed"", ""Bathtub"", ""Hangers"", ""Conditioner"", ""Laundromat nearby"", ""Free driveway parking on premises \u2013 2 spaces"", ""Cooking basics"", ""Oven"", ""Central heating"", ""Kitchen"", ""Private fenced garden or backyard"", ""Dishes and silverware"", ""Free street parking"", ""Wine glasses"", ""Microwave"", ""Free washer \u2013 In unit"", ""Iron"", ""Private patio or balcony"", ""Keurig coffee machine"", ""HDTV"", ""Clothing storage: closet"", ""Hot water"", ""Outdoor furniture"", ""Coffee maker"", ""Cleaning products"", ""Extra pillows and blankets"", ""Dishwasher""]",$163.00,2,365,2,2,365,365,2,365,NA,TRUE,26,56,86,356,2022-09-19,8,8,1,2022-03-31,2022-08-24,5,5,5,5,4.5,5,4.75,NA,FALSE,19,19,0,0,1.39,salem,MA
