46883743,https://www.airbnb.com/rooms/46883743,20220919000909,2022-09-19,city scrape,"Close to I-5 and Costco, easy to Shop and Eat","Welcome to our spacious single-level family home. Stocked kitchen with serving utensils, Keurig. The home is 3 bedrooms and 2 bathrooms. Conveniently located within minutes of I-5 Highway,  Bank, Very close to Costco, Shopping and Restaurant. To Woodburn Premium Outlets 20 mins. If you need something, we will be happy to try and accommodate or assist. No events, no parties.<br /><br /><b>The space</b><br />Parties are not allowed due to the commotion it causes. No events.<br /><br /><b>Guest access</b><br />No other visitors; the number of people booked is the same as the number of people who check in.<br />Do not move any device in the house.<br /><br /><b>Other things to note</b><br />2019 built, new home. Lovely place.Parties are not allowed due to the commotion it causes.",NA,https://a0.muscache.com/pictures/miso/Hosting-46883743/original/e18e200d-2876-48a8-b10f-537ea7c12c19.jpeg,378740541,https://www.airbnb.com/users/show/378740541,Ashley,2020-12-08,"Salem, OR",NA,within an hour,90%,100%,TRUE,https://a0.muscache.com/im/pictures/user/6c3bb8d6-c819-4ffb-bf0e-d67f156bdba3.jpg?aki_policy=profile_small,https://a0.muscache.com/im/pictures/user/6c3bb8d6-c819-4ffb-bf0e-d67f156bdba3.jpg?aki_policy=profile_x_medium,Southeast Mill Creek,1,1,"['email', 'phone']",TRUE,FALSE,NA,Ward 4,NA,44.88341,-123.00552,Entire home,Entire home/apt,4,NA,2 baths,3,3,"[""Essentials"", ""Cable TV"", ""Gas stove"", ""Private entrance"", ""Safe"", ""Wifi"", ""Dining table"", ""Heating"", ""Shampoo"", ""Freezer"", ""Shower gel"", ""Hair dryer"", ""Long term stays allowed"", ""Hangers"", ""Conditioner"", ""Patio or balcony"", ""Indoor fireplace"", ""Dedicated workspace"", ""Smart lock"", ""Washer"", ""Cooking basics"", ""Security cameras on property"", ""Oven"", ""Kitchen"", ""Air conditioning"", ""Dishes and silverware"", ""Smoke alarm"", ""First aid kit"", ""Free street parking"", ""Microwave"", ""Fire extinguisher"", ""Whirlpool refrigerator"", ""Free parking on premises"", ""Keurig coffee machine"", ""Rice maker"", ""Clothing storage: closet"", ""Hot water"", ""Dryer"", ""Carbon monoxide alarm"", ""Backyard"", ""Single level home"", ""TV with standard cable"", ""Coffee maker"", ""Dishwasher""]",$223.00,1,1125,1,1,1125,1125,1,1125,NA,TRUE,7,35,61,331,2022-09-19,52,25,4,2020-12-26,2022-09-17,4.81,4.9,4.96,4.96,4.96,4.88,4.83,NA,FALSE,1,1,0,0,2.46,salem,MA
47091813,https://www.airbnb.com/rooms/47091813,20220919000909,2022-09-19,city scrape,Lower Apartment in Historic District Near Hospital,"Nestled  in a historic district with little traffic or road noise. <br /><br />1 mile from Salem Hospital and downtown and 3 blocks from a grocery store.<br /><br />Newly renovated 1 bed/1 bath unit located in the basement (6’3”high ceilings). <br /><br />You will enjoy a fully equipped kitchen, a bright, comfy living room with Wifi, TV with a fire stick, washer/dryer is shared. <br /><br />Great location for walks and close to safe outdoor activities.<br /><br /><b>Guest access</b><br />Guest walk down four steps to enter. Watch your step.",NA,https://a0.muscache.com/pictures/14efdea3-4a01-4946-905b-8cc271a60073.jpg,51012505,https://www.airbnb.com/users/show/51012505,Amanda,2015-12-10,"Salem, OR",NA,within an hour,100%,93%,TRUE,https://a0.muscache.com/im/pictures/user/c37a3128-c5e7-45d1-b80a-9095f3576343.jpg?aki_policy=profile_small,https://a0.muscache.com/im/pictures/user/c37a3128-c5e7-45d1-b80a-9095f3576343.jpg?aki_policy=profile_x_medium,Northeast Neighbors,4,4,"['email', 'phone']",TRUE,FALSE,NA,Ward 1,NA,44.93876,-123.02266,Entire rental unit,Entire home/apt,2,NA,1 bath,1,1,"[""Essentials"", ""Hot water kettle"", ""Private entrance"", ""Bed linens"", ""Toaster"", ""Room-darkening shades"", ""Refrigerator"", ""Wifi"", ""Dining table"", ""Clothing storage"", ""Heating"", ""Freezer"", ""Portable air conditioning"", ""Hair dryer"", ""Long term stays allowed"", ""Bathtub"", ""Hangers"", ""Stove"", ""TV"", ""Washer"", ""Cooking basics"", ""Oven"", ""Kitchen"", ""Dishes and silverware"", ""Smoke alarm"", ""Free street parking"", ""Microwave"", ""Fire extinguisher"", ""Free parking on premises"", ""Carbon monoxide alarm"", ""Dryer"", ""Hot water"", ""Baking sheet"", ""Single level home"", ""Coffee maker"", ""Extra pillows and blankets""]",$87.00,30,365,1,30,1125,1125,28.5,1125,NA,TRUE,18,48,60,136,2022-09-19,18,4,1,2020-12-30,2022-08-25,4.83,4.83,4.83,4.94,4.94,4.94,4.61,NA,TRUE,4,4,0,0,0.86,salem,MA
47185169,https://www.airbnb.com/rooms/47185169,20220919000909,2022-09-19,city scrape,Fully-Furnished Sunny Guesthouse,"Welcome to a sunny cottage conveniently located in South Salem!  This 676 sq. ft. guesthouse, with its own private parking and entrances, is fully furnished and stocked to provide an easy transition and comfortable living space.  There is wifi, a work area, queen-sized bed, heating and a/c, and full-sized kitchen appliances.  It's only 1.4 miles from Salem Hospital and Willamette University.<br /><br /><b>The space</b><br />This cottage is located on our property but is a stand alone structure. You will have privacy, but if you need anything, we are close by. We renovated the cottage completely a couple of years ago.","Our cottage is located in a suburban neighborhood.  Many of the craftsman homes in our area were built about 100 years ago, and have historical charm.  It is a safe area and is close to the city in one direction and parks and shopping in another.",https://a0.muscache.com/pictures/a037050d-fee7-4a41-b0a3-2f6ba292b01f.jpg,381131161,https://www.airbnb.com/users/show/381131161,Tressa,2020-12-22,NA,NA,within an hour,100%,99%,TRUE,https://a0.muscache.com/im/pictures/user/e6aaee62-d6fd-4504-b6fc-fcadea2676da.jpg?aki_policy=profile_small,https://a0.muscache.com/im/pictures/user/e6aaee62-d6fd-4504-b6fc-fcadea2676da.jpg?aki_policy=profile_x_medium,South Central,1,1,"['email', 'phone']",TRUE,FALSE,"Salem, Oregon, United States",Ward 7,NA,44.92908,-123.04719,Entire guesthouse,Entire home/apt,2,NA,1 bath,1,1,"[""Essentials"", ""Private entrance"", ""Bed linens"", ""Toaster"", ""Room-darkening shades"", ""Refrigerator"", ""Dining table"", ""Heating"", ""Shampoo"", ""Freezer"", ""Shower gel"", ""Hair dryer"", ""Long term stays allowed"", ""Bathtub"", ""Lockbox"", ""Hangers"", ""Patio or balcony"", ""Stove"", ""TV"", ""Dedicated workspace"", ""Cooking basics"", ""Oven"", ""Kitchen"", ""Air conditioning"", ""Dishes and silverware"", ""Smoke alarm"", ""First aid kit"", ""Free street parking"", ""Microwave"", ""Fire extinguisher"", ""Wifi \u2013 19 Mbps"", ""Iron"", ""Free parking on premises"", ""Clothing storage: closet and dresser"", ""Hot water"", ""Backyard"", ""Baking sheet"", ""Outdoor furniture"", ""Coffee maker"", ""Cleaning products"", ""Extra pillows and blankets"", ""Dishwasher""]",$85.00,1,30,1,1,1125,1125,1,1125,NA,TRUE,15,35,64,64,2022-09-19,93,58,6,2020-12-24,2022-09-06,4.88,4.9,4.9,4.94,4.94,4.82,4.89,NA,TRUE,1,1,0,0,4.39,salem,MA
47308994,https://www.airbnb.com/rooms/47308994,20220919000909,2022-09-19,city scrape,Willamette Valley Wine Country Getaway!,"1. Cozy, fully private downstairs apartment, Located in the heart of Willamette Valley Wine Country, West Salem, Oregon. <br /><br />2. Over 700 sq ft of room, available with a dog run. Has separate entrance and full kitchen, dishes, glasses and silverware. <br />Able to book immediately. Not pictured is Queen Bed, sofas, and TV, books and wifi. Dog friendly up to 40 lbs. Clean, quiet and welcoming neighborhood.<br /><br /><b>The space</b><br />This is a large space with big closet, bedroom, and laundry. Stove, Refrigerator, and microwave, as well as Keurig,  and full TV VCR, WIFI<br /><br /><b>Guest access</b><br />3. Street Parking Only, not in driveway<br /><br /><b>Other things to note</b><br />4. 6'6"" plus may need to duck. <br /><br />5. Hosts available by text once booked <br /><br />6. Please do not smoke anything on property. Thanks","upscale safe neighborhood, overlooking down town salem.",https://a0.muscache.com/pictures/3b2d78e9-3cc1-40a0-be05-4665a8ec5ae5.jpg,16551601,https://www.airbnb.com/users/show/16551601,Fay,2014-06-09,"Salem, OR",friendly semi-retired and accommodating couple. Let us know how we can make your stay comfortable.,within an hour,100%,91%,FALSE,https://a0.muscache.com/im/pictures/user/c4711699-3c4e-4685-942e-f49aefbba0c3.jpg?aki_policy=profile_small,https://a0.muscache.com/im/pictures/user/c4711699-3c4e-4685-942e-f49aefbba0c3.jpg?aki_policy=profile_x_medium,West Salem,1,2,"['email', 'phone']",TRUE,TRUE,"Salem, Oregon, United States",Ward 8,NA,44.94471,-123.0856,Entire condo,Entire home/apt,3,NA,1 bath,1,1,"[""Essentials"", ""Private entrance"", ""Shared fenced garden or backyard"", ""Children\u2019s books and toys"", ""Refrigerator"", ""Heating"", ""Shampoo"", ""Dryer \u2013\u00a0In unit"", ""Hair dryer"", ""Long term stays allowed"", ""Lockbox"", ""Hangers"", ""TV"", ""Fast wifi \u2013 415 Mbps"", ""Washer \u2013\u00a0In unit"", ""Dedicated workspace"", ""Security cameras on property"", ""Breakfast"", ""Kitchen"", ""Air conditioning"", ""Dishes and silverware"", ""Fire pit"", ""BBQ grill"", ""Iron"", ""Private patio or balcony"", ""Free parking on premises"", ""Outdoor furniture"", ""Coffee maker""]",$194.00,1,1125,1,1,1125,1125,1,1125,NA,TRUE,0,17,47,321,2022-09-19,24,19,1,2021-08-07,2022-08-21,4.83,4.83,4.96,5,4.88,4.92,4.79,NA,FALSE,1,1,0,0,1.76,salem,MA
47958424,https://www.airbnb.com/rooms/47958424,20220919000909,2022-09-19,previous scrape,"Furnished flat with office near Bush Park, Salem","Fully furnished with all the needs in a kitchen, bed and bath.  The office is spacious for all your computer needs.",NA,https://a0.muscache.com/pictures/c09c519f-516d-47f5-9037-9f47649a9de8.jpg,102278503,https://www.airbnb.com/users/show/102278503,Victoria,2016-11-02,NA,NA,within a day,100%,100%,FALSE,https://a0.muscache.com/im/pictures/user/ee953144-987a-43c8-b5be-e26799302ff8.jpg?aki_policy=profile_small,https://a0.muscache.com/im/pictures/user/ee953144-987a-43c8-b5be-e26799302ff8.jpg?aki_policy=profile_x_medium,South Central,6,6,['phone'],TRUE,FALSE,NA,Ward 2,NA,44.92637,-123.03363,Entire rental unit,Entire home/apt,2,NA,1 bath,1,1,"[""Essentials"", ""Keypad"", ""Private entrance"", ""Bed linens"", ""Room-darkening shades"", ""Refrigerator"", ""Wifi"", ""Dining table"", ""Heating"", ""Shampoo"", ""Long term stays allowed"", ""Bathtub"", ""Hangers"", ""Cleaning before checkout"", ""Stove"", ""TV"", ""Dedicated workspace"", ""Cooking basics"", ""Extra pillows and blankets"", ""Oven"", ""Kitchen"", ""Air conditioning"", ""Dishes and silverware"", ""Smoke alarm"", ""Free street parking"", ""Microwave"", ""Fire extinguisher"", ""Waterfront"", ""Iron"", ""Carbon monoxide alarm"", ""Dryer"", ""Hot water"", ""Outdoor furniture"", ""Paid parking on premises"", ""Coffee maker""]",$89.00,60,365,60,60,365,365,60,365,NA,TRUE,17,17,17,33,2022-09-19,2,2,0,2021-10-31,2022-04-01,5,4.5,5,5,5,4.5,5,NA,FALSE,5,5,0,0,0.19,salem,MA
47987577,https://www.airbnb.com/rooms/47987577,20220919000909,2022-09-19,city scrape,Upper Apartment in Historic District Near Hospital,"Nestled  in a historic district. <br />1 mile from Salem Hospital and downtown Salem, 3 blocks from grocery store.<br /><br />1 bed/1 bath unit located in the upstairs unit. <br />Enjoy a fully equipped kitchen, a bright, comfy living room with Wifi, smart TV , shared washer/dryer. <br /><br />Great location for walks and close to safe outdoor activities.<br /><br /><b>Guest access</b><br />Must walk up one and a half flights of stairs to apartment door.<br /><br /><b>Other things to note</b><br />See images of bathroom, small throughway to toilet and shower.",NA,https://a0.muscache.com/pictures/14efdea3-4a01-4946-905b-8cc271a60073.jpg,51012505,https://www.airbnb.com/users/show/51012505,Amanda,2015-12-10,"Salem, OR",NA,within an hour,100%,93%,TRUE,https://a0.muscache.com/im/pictures/user/c37a3128-c5e7-45d1-b80a-9095f3576343.jpg?aki_policy=profile_small,https://a0.muscache.com/im/pictures/user/c37a3128-c5e7-45d1-b80a-9095f3576343.jpg?aki_policy=profile_x_medium,Northeast Neighbors,4,4,"['email', 'phone']",TRUE,FALSE,NA,Ward 1,NA,44.93742,-123.02176,Entire home,Entire home/apt,2,NA,1 bath,1,2,"[""Essentials"", ""Keypad"", ""Hot water kettle"", ""Private entrance"", ""Bed linens"", ""Room-darkening shades"", ""Ceiling fan"", ""Refrigerator"", ""Wifi"", ""Dining table"", ""Clothing storage"", ""Heating"", ""Freezer"", ""Long term stays allowed"", ""Bathtub"", ""Hangers"", ""Stove"", ""TV"", ""Dedicated workspace"", ""Washer"", ""Cooking basics"", ""Oven"", ""Kitchen"", ""Air conditioning"", ""Dishes and silverware"", ""Smoke alarm"", ""Free street parking"", ""Microwave"", ""Fire extinguisher"", ""Free parking on premises"", ""Carbon monoxide alarm"", ""Dryer"", ""Hot water"", ""Baking sheet"", ""Single level home"", ""Coffee maker""]",$90.00,30,1125,1,30,1125,1125,27.8,1125,NA,TRUE,1,1,9,98,2022-09-19,11,7,2,2021-07-05,2022-08-27,4.82,4.91,4.91,5,4.91,4.91,4.82,NA,TRUE,4,4,0,0,0.75,salem,MA
48000304,https://www.airbnb.com/rooms/48000304,20220919000909,2022-09-19,city scrape,1950's Charm-Great for long/short term. Come stay!,"Great area in Salem! Minutes from downtown, quiet street, walk to Bush park, very comfortable neighborhood. This 1950's house has 2 bedrooms with ample closet space, an office with door to the backyard and deck, spacious living room with a cozy gas fireplace, smart TV, garage with washer and dryer accessed through the kitchen, gas stove and many other amenities. The house is easy to get to from I5, about an hour from Portland. Perfect for a 1-2 couples or a small family. Most everything is new!<br /><br /><b>The space</b><br />You will have the whole house to yourself! There are 2 bedrooms, one with a queen bed and the other with a full size bed. There are dressers and closets with wood hangers in each. Both rooms have night stands with lamps and nightlights. Extra bedding can be found in the closets or the linen closet in the hall. <br /><br />The office has a generous desk and chair, sitting area and a door to the backyard deck. I love the sunlight this room gets. The office closet h","The house is 5 minutes from Willamette University, 6 minutes to the Capital building, downtown Salem and Salem Hospital. <br /><br />Bush's Pasture park is about a 15 minute very pleasant walk from the house. Minto-Brown Island Park is about 10 minutes drive away.<br /><br />The stunning Oregon coast is about an hour and 15 minutes away and is a must see if you have never been. <br /><br />Mt Hood skiing, snowboarding and winter activities are about 2 hours away. This area is also beautiful in the summer. <br /><br />The house is about 55 minutes from downtown Portland where you can find all the big city attractions.<br /><br />Here is a link to some local Salem sights:<br /><br />https://link.oregonlive.com/view/5e8c7cf20bbeac2af433d63aeazfc.1fm/4f30e394",https://a0.muscache.com/pictures/500822e5-d1b9-46c3-a12f-5749b67ef61a.jpg,12285441,https://www.airbnb.com/users/show/12285441,Sheri,2014-02-16,"Milwaukie, OR","I love to travel, most recently I went on a 2 week  cruise through the Panama Canal, Central America and just touching South America, and Prior to that I spent September in the Greek Isles. I have been to Hungary, England, Germany,  Scotland and Italy recently, but have also been to Thailand, Costa Rica, Ireland, Belgium, Spain, New Zealand, Mexico, Portugal, Canada and more. During the warmer months I like to get on the river kayaking-flat water and garden. My house is full of books which you are welcome to. I like tea, rocks, playing pool, spicy food, getting together with family and friends. Laughter is important to me. 
I am an RN. I eat a vegetarian diet but have no problem if you do not.
I grew up in Portland, lived away for 7 years and returned when I started my family. I raised my 3 daughters essentially on my own with a little help from my folks and siblings. They are grown now-my oldest living in Alaska, the other 2 in Oregon- the youngest is only a couple miles away. 
I am often away from home for several hours to days or more but can check my email and phone usually.
 Smoking is OK on the back patio and front porch if desired, away from open doors and windows. The Portland metro area has much to offer and I like to get out for the experience. I am open but know how to give people their space. Feel free to ask me anything. 
I enjoy helping people, fun, new faces and places. I like games and friendly competition, movies and the feel of a good book in my hands. I've lately started watching some shows on HBO, Netflix and Hulu after a long hiatus from TV. I have a soft spot for sci-fi and fantasy-don't judge! Traveling is important to me.
My daughter comes to visit sometimes with her old Min Pin named Bella who is very sweet and quite blind. An old bike available upon request though the tires may need air.",within an hour,100%,97%,TRUE,https://a0.muscache.com/im/users/12285441/profile_pic/1392601806/original.jpg?aki_policy=profile_small,https://a0.muscache.com/im/users/12285441/profile_pic/1392601806/original.jpg?aki_policy=profile_x_medium,South Central,4,4,"['email', 'phone']",TRUE,FALSE,"Salem, Oregon, United States",Ward 2,NA,44.91716,-123.03851,Entire home,Entire home/apt,4,NA,1 bath,2,2,"[""Essentials"", ""Portable fans"", ""Hot water kettle"", ""Private entrance"", ""Bed linens"", ""Toaster"", ""Refrigerator"", ""Wifi"", ""Dining table"", ""Heating"", ""Shampoo"", ""Freezer"", ""Free dryer \u2013 In unit"", ""Shower gel"", ""Hair dryer"", ""Long term stays allowed"", ""Bathtub"", ""Hangers"", ""Conditioner"", ""Shared patio or balcony"", ""Cleaning before checkout"", ""Outlet covers"", ""Barbecue utensils"", ""Children\u2019s dinnerware"", ""Indoor fireplace"", ""Dedicated workspace"", ""Gas oven stainless steel oven"", ""Smart lock"", ""Cooking basics"", ""Breakfast"", ""Kitchen"", ""Private fenced garden or backyard"", ""Dishes and silverware"", ""Smoke alarm"", ""First aid kit"", ""Drying rack for clothing"", ""Wine glasses"", ""Microwave"", ""Gas stove stainless steel stove"", ""Free street parking"", ""Free washer \u2013 In unit"", ""Iron"", ""BBQ grill"", ""Pour-over coffee"", ""Free parking on premises"", ""Clothing storage: closet and dresser"", ""Hot water"", ""Carbon monoxide alarm"", ""Baking sheet"", ""HDTV with Netflix"", ""Outdoor furniture"", ""Single level home"", ""Body soap"", ""Coffee maker"", ""Cleaning products"", ""Extra pillows and blankets"", ""Dishwasher""]",$158.00,7,1125,7,14,1125,1125,11.2,1125,NA,TRUE,0,0,0,117,2022-09-19,40,19,1,2021-02-22,2022-08-30,4.95,4.95,4.88,5,5,5,4.95,NA,TRUE,1,1,0,0,2.09,salem,MA
48138030,https://www.airbnb.com/rooms/48138030,20220919000909,2022-09-19,city scrape,"Private entry, beautiful farmhouse vibe and quiet","Amazing popular Airbnb nightly rental, one of a kind. More than a room/suite, it’s an adventure! <br />Whether your visiting family/friends or working in the area, you’ll love my private daylight basement w/queen bed, private bathroom and entrance.  French doors open into the backyard. Driveway parking.  New 50 inch Flat screen TV with Hulu and Netflix. <br />Near Minto Brown, 3.2 miles to Salem Hospital, and close to Downtown Salem, state buildings and Willamette U. 1 hour drive to Portland.<br /><br /><b>The space</b><br />A farmhouse vibe in a great safe neighborhood. There is plenty of room to stretch out and settle in for the night. Long term guests are welcome to enjoy my gourmet kitchen with 2 ovens and gas stove. Kitchen is well stocked with pots and pans. Washer and dryer avail on request.<br /><br /><b>Guest access</b><br />Hassle free check in. Guests will park in the driveway. Short easy walk to the private entrance of daylight basement and the walkway is well lit at night.","Desirable area in S Salem. Beautiful homes in a safe neighborhood. <br />Near Minto Brown Park, Salem Hospital and downtown Salem. 45-60 minutes to Portland. Lots of places to go hiking.",https://a0.muscache.com/pictures/dadeb24b-b215-47a6-94a6-44577170af5e.jpg,45044784,https://www.airbnb.com/users/show/45044784,Debbie,2015-09-25,"Salem, OR",NA,within an hour,100%,99%,TRUE,https://a0.muscache.com/im/users/45044784/profile_pic/1443157769/original.jpg?aki_policy=profile_small,https://a0.muscache.com/im/users/45044784/profile_pic/1443157769/original.jpg?aki_policy=profile_x_medium,South Salem,4,4,"['email', 'phone']",TRUE,TRUE,"Salem, Oregon, United States",Ward 7,NA,44.91103,-123.06537,Entire guest suite,Entire home/apt,2,NA,1 bath,1,1,"[""Essentials"", ""Private entrance"", ""Toaster"", ""Central air conditioning"", ""Refrigerator"", ""Heating"", ""Shampoo"", ""Freezer"", ""Shower gel"", ""Hair dryer"", ""Long term stays allowed"", ""Lockbox"", ""Hangers"", ""Conditioner"", ""High chair"", ""Stove"", ""Barbecue utensils"", ""Indoor fireplace"", ""Dedicated workspace"", ""Washer"", ""Pack \u2019n play/Travel crib"", ""Cooking basics"", ""Oven"", ""Kitchen"", ""Dishes and silverware"", ""Smoke alarm"", ""First aid kit"", ""Free street parking"", ""Wine glasses"", ""Microwave"", ""Fire extinguisher"", ""Fire pit"", ""BBQ grill"", ""Iron"", ""Board games"", ""Private patio or balcony"", ""Keurig coffee machine"", ""Free parking on premises"", ""HDTV"", ""Rice maker"", ""Carbon monoxide alarm"", ""Hot water"", ""Dryer"", ""Baking sheet"", ""Backyard"", ""Outdoor furniture"", ""Body soap"", ""Wifi \u2013 37 Mbps"", ""Cleaning products"", ""Coffee maker"", ""Dishwasher""]",$101.00,1,1125,1,1,1125,1125,1,1125,NA,TRUE,13,39,63,152,2022-09-19,76,38,5,2021-03-28,2022-09-11,5,4.97,5,5,4.99,4.97,4.97,NA,FALSE,3,2,1,0,4.21,salem,MA
48186390,https://www.airbnb.com/rooms/48186390,20220919000909,2022-09-19,city scrape,Willamette River Guesthouse,"The mighty Willamette River is one of the few rivers in the world that flows north. From the comfort of our 1300 sq/ft guesthouse, visitors will enjoy a front row view of the river and all of its offerings….serene sunsets, birdwatching, wildlife, and more. <br /><br />The Willamette Valley is wine country! Several wineries in the immediate area, and beyond, to explore. <br /><br />With convenient access to I5, you are only one hour to Portland or the coast, and about 2.5 hours to Mt. Hood -perfect day trip!<br /><br /><b>The space</b><br />Light continental-style breakfast included at this cozy retreat on the Willamette River. The master bedroom offers a newly remodeled ensuite bathroom with dual shower heads & a bluetooth speaker/light/fan. Memory Fiber cooling pillows for both beds and a memory foam mattress topper in the second bedroom. Stackable laundry unit in the hall between the master and the second bathroom. Large windows give you plenty of natural light and river views from t","If you can peel yourself away from the river, you will find a very active walking/jogging/bicycle friendly neighborhood with multiple parks and a Little Free Library to discover along the way.  Be sure to check out Sunset Park, which takes you right up to the waters edge!",https://a0.muscache.com/pictures/f578d51a-cd65-4d81-93aa-2bcc6c9baf34.jpg,24077619,https://www.airbnb.com/users/show/24077619,Cheryl,2014-11-23,"Keizer, OR","Hello Fellow Adventurers!

My husband and I are professionals, and, recent Empty-Nesters. We love family, food, good conversation, and fair-weather outdoor activities (wink). We moved to the PNW, from the Bay Area, 20 years ago and enjoy travel as much as we enjoy a cozy night-in at home. Always trying to be more intentional with this one life we have to live.

""One day, or, day one - you decide.”   ~author unknown

",within an hour,100%,100%,TRUE,https://a0.muscache.com/im/users/24077619/profile_pic/1416773451/original.jpg?aki_policy=profile_small,https://a0.muscache.com/im/users/24077619/profile_pic/1416773451/original.jpg?aki_policy=profile_x_medium,NA,4,9,"['email', 'phone']",TRUE,TRUE,"Keizer, Oregon, United States",Ward 5,NA,44.9747,-123.03446,Entire guesthouse,Entire home/apt,7,NA,2 baths,2,2,"[""Essentials"", ""Keypad"", ""Hot water kettle"", ""Private entrance"", ""Bed linens"", ""Shared fenced garden or backyard"", ""Ethernet connection"", ""Toaster"", ""Room-darkening shades"", ""Ceiling fan"", ""Refrigerator"", ""Luggage dropoff allowed"", ""Dining table"", ""Free dryer \u2013 In unit"", ""Electric stove"", ""Shower gel"", ""Hair dryer"", ""Kirkland conditioner"", ""Fast wifi \u2013 201 Mbps"", ""Outdoor dining area"", ""Long term stays allowed"", ""Kirkland shampoo"", ""Bathtub"", ""Hangers"", ""TV"", ""Indoor fireplace"", ""Dedicated workspace"", ""Cooking basics"", ""Security cameras on property"", ""Oven"", ""Breakfast"", ""Central heating"", ""Kitchen"", ""Dishes and silverware"", ""Smoke alarm"", ""First aid kit"", ""Free street parking"", ""Wine glasses"", ""Microwave"", ""Fire extinguisher"", ""Fire pit"", ""Children\u2019s books and toys for ages 5-10 years old and 10+ years old"", ""Waterfront"", ""Free washer \u2013 In unit"", ""Iron"", ""Board games"", ""BBQ grill"", ""Private patio or balcony"", ""Free parking on premises"", ""Piano"", ""Clothing storage: closet"", ""Hot water"", ""Carbon monoxide alarm"", ""Baking sheet"", ""Single level home"", ""Outdoor furniture"", ""Body soap"", ""Coffee maker"", ""Cleaning products"", ""Extra pillows and blankets"", ""Dishwasher""]",$200.00,2,1125,2,2,1125,1125,2,1125,NA,TRUE,12,38,65,331,2022-09-19,68,35,4,2021-02-17,2022-09-09,4.97,4.88,4.96,4.97,4.94,4.96,4.87,NA,FALSE,1,1,0,0,3.52,salem,MA
